Camisa ;com manga;KISS ROCK AND ROLL;GG;Kiss;;Kiss Rock And Roll;CAMISA CM GG KISS ROCK AND ROLL;VIRUS;77;12,5;30;9;CMCMGG00129;1;
Camisa ;com manga;KORN ESCRITO;P;Korn;;Korn Escrito;CAMISA CM P KORN ESCRITO;EQ;227;11;30;6;CMCMP00038;1;
Camisa ;com manga;KORN ESCRITO;M;Korn;;Korn Escrito;CAMISA CM M KORN ESCRITO;EQ;227;11;30;3;CMCMM00037;1;
Camisa ;com manga;KORN ESCRITO;G;Korn;;Korn Escrito;CAMISA CM G KORN ESCRITO;EQ;227;11;30;4;CMCMG00038;1;
Camisa ;com manga;KORN UNTOUCHBLES;P;Korn;;Korn Untouchbles;CAMISA CM P KORN UNTOUCHBLES;EQ;357;11;30;0;CMCMP00064;1;
Camisa ;com manga;KORN UNTOUCHBLES;M;Korn;;Korn Untouchbles;CAMISA CM M KORN UNTOUCHBLES;EQ;357;11;30;0;CMCMM00064;1;
Camisa ;com manga;KORN UNTOUCHBLES;G;Korn;;Korn Untouchbles;CAMISA CM G KORN UNTOUCHBLES;EQ;357;11;30;4;CMCMG00064;1;
Camisa ;com manga;KREATOR PHANTOM;M;Kreator;;Kreator Phantom;CAMISA CM M KREATOR PHANTOM;BLACK ANGE;5;12,5;30;5;CMCMM00254;1;
Camisa ;com manga;KREATOR PHANTOM;G;Kreator;;Kreator Phantom;CAMISA CM G KREATOR PHANTOM;BLACK ANGE;5;12,5;30;11;CMCMG00248;1;
Camisa ;com manga;KREATOR PHANTOM;GG;Kreator;;Kreator Phantom;CAMISA CM GG KREATOR PHANTOM;BLACK ANGE;5;12,5;30;4;CMCMGG00181;1;
Camisa ;com manga;KREATOR PLEASURE;M;Kreator;;Kreator Pleasure;CAMISA CM M KREATOR PLEASURE;PROFANUS;111;12,5;30;7;CMCMM00206;1;
Camisa ;com manga;KREATOR PLEASURE;G;Kreator;;Kreator Pleasure;CAMISA CM G KREATOR PLEASURE;PROFANUS;111;12,5;30;6;CMCMG00207;1;
Camisa ;com manga;KREATOR PLEASURE;GG;Kreator;;Kreator Pleasure;CAMISA CM GG KREATOR PLEASURE;PROFANUS;111;12,5;30;6;CMCMGG00141;1;
Camisa ;com manga;LARANJA MECANICA;PP;Laranja Mecanica;;Laranja Mecanica;CAMISA CM PP LARANJA MECANICA;AN;5;12;30;0;CMCMPP00009;1;
Camisa ;com manga;LARANJA MECANICA;P;Laranja Mecanica;;Laranja Mecanica;CAMISA CM P LARANJA MECANICA;AN;5;11;30;8;CMCMP00230;1;
Camisa ;com manga;LARANJA MECANICA;M;Laranja Mecanica;;Laranja Mecanica;CAMISA CM M LARANJA MECANICA;AN;5;11;30;9;CMCMM00310;1;
Camisa ;com manga;LARANJA MECANICA;G;Laranja Mecanica;;Laranja Mecanica;CAMISA CM G LARANJA MECANICA;AN;5;11;30;14;CMCMG00313;1;
Camisa ;com manga;LARANJA MECANICA;GG;Laranja Mecanica;;Laranja Mecanica;CAMISA CM GG LARANJA MECANICA;AN;5;11;30;14;CMCMGG00233;1;
Camisa ;com manga;LEAGUE OF LEGENDS;P;Games;;League Of Legends;CAMISA CM P LEAGUE OF LEGENDS;HCD;292;12;30;9;CMCMP00297;1;
Camisa ;com manga;LEAGUE OF LEGENDS;M;Games;;League Of Legends;CAMISA CM M LEAGUE OF LEGENDS;HCD;292;12;30;4;CMCMM00358;1;
Camisa ;com manga;LEAGUE OF LEGENDS;G;Games;;League Of Legends;CAMISA CM G LEAGUE OF LEGENDS;HCD;292;12;30;7;CMCMG00366;1;
Camisa ;com manga;LEAGUE OF LEGENDS;GG;Games;;League Of Legends;CAMISA CM GG LEAGUE OF LEGENDS;HCD;292;12;30;14;CMCMGG00283;1;
Camisa ;com manga;LEAGUE OF LEGENDS;XGG;Games;;League Of Legends;CAMISA CM XGG LEAGUE OF LEGENDS;HCD;292;15;36;3;CMCMXGG00043;1;
Camisa ;com manga;LED ZEPPELIN ANJO COLORIDO;M;Led Zeppelin;;Led Zeppelin Anjo Colorido;CAMISA CM M LED ZEPPELIN ANJO COLORIDO;VIRUS;24;12,5;30;6;CMCMM00178;1;
Camisa ;com manga;LED ZEPPELIN ANJO COLORIDO;G;Led Zeppelin;;Led Zeppelin Anjo Colorido;CAMISA CM G LED ZEPPELIN ANJO COLORIDO;VIRUS;24;12,5;30;0;CMCMG00176;1;
Camisa ;com manga;LED ZEPPELIN ANJO COLORIDO;GG;Led Zeppelin;;Led Zeppelin Anjo Colorido;CAMISA CM GG LED ZEPPELIN ANJO COLORIDO;VIRUS;24;12,5;30;3;CMCMGG00116;1;
Camisa ;com manga;LED ZEPPELIN ANJO DOURADO;P;Led Zeppelin;;Led Zeppelin Anjo Dourado;CAMISA CM P LED ZEPPELIN ANJO DOURADO;EQ;58;11;30;4;CMCMP00010;1;
Camisa ;com manga;LED ZEPPELIN ANJO DOURADO;M;Led Zeppelin;;Led Zeppelin Anjo Dourado;CAMISA CM M LED ZEPPELIN ANJO DOURADO;EQ;58;11;30;7;CMCMM00009;1;
Camisa ;com manga;LED ZEPPELIN ANJO DOURADO;G;Led Zeppelin;;Led Zeppelin Anjo Dourado;CAMISA CM G LED ZEPPELIN ANJO DOURADO;EQ;58;11;30;7;CMCMG00010;1;
Camisa ;com manga;LED ZEPPELIN ANJO DOURADO;GG;Led Zeppelin;;Led Zeppelin Anjo Dourado;CAMISA CM GG LED ZEPPELIN ANJO DOURADO;EQ;58;11;30;7;CMCMGG00079;1;
Camisa ;com manga;LED ZEPPELIN BANDA AMARELA;M;Led Zeppelin;;Led Zeppelin Banda Amarela;CAMISA CM M LED ZEPPELIN BANDA AMARELA;VIRUS;3;12,5;30;5;CMCMM00299;1;
Camisa ;com manga;LED ZEPPELIN BANDA AMARELA;G;Led Zeppelin;;Led Zeppelin Banda Amarela;CAMISA CM G LED ZEPPELIN BANDA AMARELA;VIRUS;3;12,5;30;14;CMCMG00301;1;
Camisa ;com manga;LED ZEPPELIN BANDA AMARELA;GG;Led Zeppelin;;Led Zeppelin Banda Amarela;CAMISA CM GG LED ZEPPELIN BANDA AMARELA;VIRUS;3;12,5;30;4;CMCMGG00222;1;
Camisa ;com manga;LED ZEPPELIN EREMITA;P;Led Zeppelin;;Led Zeppelin Eremita;CAMISA CM P LED ZEPPELIN EREMITA;EQ;434;11;30;12;CMCMP00086;1;
Camisa ;com manga;LED ZEPPELIN EREMITA;M;Led Zeppelin;;Led Zeppelin Eremita;CAMISA CM M LED ZEPPELIN EREMITA;EQ;434;11;30;2;CMCMM00086;1;
Camisa ;com manga;LED ZEPPELIN EREMITA;G;Led Zeppelin;;Led Zeppelin Eremita;CAMISA CM G LED ZEPPELIN EREMITA;EQ;434;11;30;8;CMCMG00083;1;
Camisa ;com manga;LED ZEPPELIN EREMITA;GG;Led Zeppelin;;Led Zeppelin Eremita;CAMISA CM GG LED ZEPPELIN EREMITA;EQ;434;10,5;30;0;CMCMGG00045;1;
Camisa ;com manga;LED ZEPPELIN MOTHERSHIP;P;Led Zeppelin;;Led Zeppelin Mothership;CAMISA CM P LED ZEPPELIN MOTHERSHIP;EQ;775;11;30;0;CMCMP00135;1;
Camisa ;com manga;LED ZEPPELIN MOTHERSHIP;M;Led Zeppelin;;Led Zeppelin Mothership;CAMISA CM M LED ZEPPELIN MOTHERSHIP;EQ;775;11;30;0;CMCMM00133;1;
Camisa ;com manga;LED ZEPPELIN MOTHERSHIP;G;Led Zeppelin;;Led Zeppelin Mothership;CAMISA CM G LED ZEPPELIN MOTHERSHIP;EQ;775;11;30;3;CMCMG00131;1;
Camisa ;com manga;LED ZEPPELIN MOTHERSHIP;GG;Led Zeppelin;;Led Zeppelin Mothership;CAMISA CM GG LED ZEPPELIN MOTHERSHIP;EQ;775;10,5;30;17;CMCMGG00075;1;
Camisa ;com manga;LEGIAO URBANA 4 ESTACOES;P;Legiao Urbana;;Legiao Urbana 4 Estacoes;CAMISA CM P LEGIAO URBANA 4 ESTACOES;EQ;59;11;30;8;CMCMP00011;1;
Camisa ;com manga;LEGIAO URBANA 4 ESTACOES;M;Legiao Urbana;;Legiao Urbana 4 Estacoes;CAMISA CM M LEGIAO URBANA 4 ESTACOES;EQ;59;10,5;30;7;CMCMM00010;1;
Camisa ;com manga;LEGIAO URBANA 4 ESTACOES;G;Legiao Urbana;;Legiao Urbana 4 Estacoes;CAMISA CM G LEGIAO URBANA 4 ESTACOES;EQ;59;11;30;6;CMCMG00011;1;
Camisa ;com manga;LEGIAO URBANA 4 ESTACOES;GG;Legiao Urbana;;Legiao Urbana 4 Estacoes;CAMISA CM GG LEGIAO URBANA 4 ESTACOES;EQ;59;11;30;7;CMCMGG00008;1;
Camisa ;com manga;LEGIAO URBANA BANDA AZUL MASTER;M;Legiao Urbana;;Legiao Urbana Banda Azul Master;CAMISA CM M LEGIAO URBANA BANDA AZUL MASTER;MR;111;12,5;30;0;CMCMM00275;1;
Camisa ;com manga;LEGIAO URBANA BANDA AZUL MASTER;G;Legiao Urbana;;Legiao Urbana Banda Azul Master;CAMISA CM G LEGIAO URBANA BANDA AZUL MASTER;MR;111;12,5;30;2;CMCMG00276;1;
Camisa ;com manga;LEGIAO URBANA BANDA AZUL MASTER;GG;Legiao Urbana;;Legiao Urbana Banda Azul Master;CAMISA CM GG LEGIAO URBANA BANDA AZUL MASTER;MR;111;12,5;30;6;CMCMGG00204;1;
Camisa ;com manga;LEGIAO URBANA BONEQUINHOS;GG;Legiao Urbana;;Legiao Urbana Bonequinhos;CAMISA CM GG LEGIAO URBANA BONEQUINHOS;EQ;161;10,5;24;0;CMCMGG00051;;
Camisa ;com manga;LEGIAO URBANA DOURADA;P;Legiao Urbana;;Legiao Urbana Dourada;CAMISA CM P LEGIAO URBANA DOURADA;EQ;222;11;30;13;CMCMP00037;1;
Camisa ;com manga;LEGIAO URBANA DOURADA;M;Legiao Urbana;;Legiao Urbana Dourada;CAMISA CM M LEGIAO URBANA DOURADA;EQ;222;10,5;30;17;CMCMM00036;1;
Camisa ;com manga;LEGIAO URBANA DOURADA;G;Legiao Urbana;;Legiao Urbana Dourada;CAMISA CM G LEGIAO URBANA DOURADA;EQ;222;11;30;8;CMCMG00037;1;
Camisa ;com manga;LEGIAO URBANA DOURADA;GG;Legiao Urbana;;Legiao Urbana Dourada;CAMISA CM GG LEGIAO URBANA DOURADA;EQ;222;11;30;5;CMCMGG00027;1;
Camisa ;com manga;LEGIAO URBANA FAROESTE;M;Legiao Urbana;;Legiao Urbana Faroeste;CAMISA CM M LEGIAO URBANA FAROESTE;MR;83;12,5;30;1;CMCMM00271;1;
Camisa ;com manga;LEGIAO URBANA FAROESTE;G;Legiao Urbana;;Legiao Urbana Faroeste;CAMISA CM G LEGIAO URBANA FAROESTE;MR;83;12,5;30;1;CMCMG00272;1;
Camisa ;com manga;LEGIAO URBANA FAROESTE;GG;Legiao Urbana;;Legiao Urbana Faroeste;CAMISA CM GG LEGIAO URBANA FAROESTE;MR;83;12,5;30;2;CMCMGG00202;1;
Camisa ;com manga;LEGIAO URBANA VERDE;P;Legiao Urbana;;Legiao Urbana Verde;CAMISA CM P LEGIAO URBANA VERDE;EQ;129;11;30;8;CMCMP00030;1;
Camisa ;com manga;LEGIAO URBANA VERDE;M;Legiao Urbana;;Legiao Urbana Verde;CAMISA CM M LEGIAO URBANA VERDE;EQ;129;10,5;30;10;CMCMM00029;1;
Camisa ;com manga;LEGIAO URBANA VERDE;G;Legiao Urbana;;Legiao Urbana Verde;CAMISA CM G LEGIAO URBANA VERDE;EQ;129;11;30;11;CMCMG00031;1;
Camisa ;com manga;LEGIAO URBANA VERDE;GG;Legiao Urbana;;Legiao Urbana Verde;CAMISA CM GG LEGIAO URBANA VERDE;EQ;129;11;30;7;CMCMGG00050;1;
Camisa ;com manga;LINKIN PARK METEORA;P;Linkin Park;;Linkin Park Meteora;CAMISA CM P LINKIN PARK METEORA;EQ;385;10,5;30;6;CMCMP00073;1;
Camisa ;com manga;LINKIN PARK METEORA;M;Linkin Park;;Linkin Park Meteora;CAMISA CM M LINKIN PARK METEORA;EQ;385;11;30;7;CMCMM00073;1;
Camisa ;com manga;LINKIN PARK METEORA;G;Linkin Park;;Linkin Park Meteora;CAMISA CM G LINKIN PARK METEORA;EQ;385;11;30;3;CMCMG00072;1;
Camisa ;com manga;LINKIN PARK ROAD ESCRITO BRANCO;P;Linkin Park;;Linkin Park Road Escrito Branco;CAMISA CM P LINKIN PARK ROAD ESCRITO BRANCO;EQ;792;11;30;7;CMCMP00141;1;
Camisa ;com manga;LINKIN PARK ROAD ESCRITO BRANCO;M;Linkin Park;;Linkin Park Road Escrito Branco;CAMISA CM M LINKIN PARK ROAD ESCRITO BRANCO;EQ;792;11;30;6;CMCMM00139;1;
Camisa ;com manga;LINKIN PARK ROAD ESCRITO BRANCO;G;Linkin Park;;Linkin Park Road Escrito Branco;CAMISA CM G LINKIN PARK ROAD ESCRITO BRANCO;EQ;792;11;30;9;CMCMG00136;1;
Camisa ;com manga;LINKIN PARK SOLDADO HYBRID;P;Linkin Park;;Linkin Park Soldado Hybrid;CAMISA CM P LINKIN PARK SOLDADO HYBRID;EQ;313;10,5;30;7;CMCMP00053;1;
Camisa ;com manga;LINKIN PARK SOLDADO HYBRID;M;Linkin Park;;Linkin Park Soldado Hybrid;CAMISA CM M LINKIN PARK SOLDADO HYBRID;EQ;313;10,5;30;8;CMCMM00053;1;
Camisa ;com manga;LINKIN PARK SOLDADO HYBRID;G;Linkin Park;;Linkin Park Soldado Hybrid;CAMISA CM G LINKIN PARK SOLDADO HYBRID;EQ;313;11;30;7;CMCMG00053;1;
Camisa ;com manga;LYNYRD CAVEIRA;P;Lynyrd Skynyrd;;Lynyrd Caveira;CAMISA CM P LYNYRD CAVEIRA;EQ;764;11;30;2;CMCMP00128;1;
Camisa ;com manga;LYNYRD CAVEIRA;M;Lynyrd Skynyrd;;Lynyrd Caveira;CAMISA CM M LYNYRD CAVEIRA;EQ;764;11;30;0;CMCMM00126;1;
Camisa ;com manga;LYNYRD CAVEIRA;G;Lynyrd Skynyrd;;Lynyrd Caveira;CAMISA CM G LYNYRD CAVEIRA;EQ;764;11;30;0;CMCMG00123;1;
Camisa ;com manga;LYNYRD CAVEIRA;GG;Lynyrd Skynyrd;;Lynyrd Caveira;CAMISA CM GG LYNYRD CAVEIRA;EQ;764;11;30;4;CMCMGG00070;1;
Camisa ;com manga;LYNYRD ESCRITO;P;Lynyrd Skynyrd;;Lynyrd Escrito;CAMISA CM P LYNYRD ESCRITO;EQ;772;10,5;24;0;CMCMP00133;;
Camisa ;com manga;MARILYN CAVEIRA;P;Caveira;;Marilyn Caveira;CAMISA CM P MARILYN CAVEIRA;HCD;322;13,5;30;3;CMCMP00324;1;
Camisa ;com manga;MARILYN CAVEIRA;M;Caveira;;Marilyn Caveira;CAMISA CM M MARILYN CAVEIRA;HCD;322;13,5;30;4;CMCMM00391;1;
Camisa ;com manga;MARILYN CAVEIRA;G;Caveira;;Marilyn Caveira;CAMISA CM G MARILYN CAVEIRA;HCD;322;13,5;30;5;CMCMG00400;1;
Camisa ;com manga;MARILYN MANSON;M;Marilyn Manson;;Marilyn Manson;CAMISA CM M MARILYN MANSON;MR;48;12,5;30;5;CMCMM00265;1;
Camisa ;com manga;MARILYN MANSON;G;Marilyn Manson;;Marilyn Manson;CAMISA CM G MARILYN MANSON;MR;48;12,5;30;11;CMCMG00266;1;
Camisa ;com manga;MARIO LUIGI;P;Games;;Mario Luigi;CAMISA CM P MARIO LUIGI;VIRUS;141;12;30;1;CMCMP00289;1;
Camisa ;com manga;MARIO LUIGI;M;Games;;Mario Luigi;CAMISA CM M MARIO LUIGI;VIRUS;141;12;30;7;CMCMM00350;1;
Camisa ;com manga;MARIO LUIGI;G;Games;;Mario Luigi;CAMISA CM G MARIO LUIGI;VIRUS;141;12;30;2;CMCMG00357;1;
Camisa ;com manga;MARIO LUIGI;GG;Games;;Mario Luigi;CAMISA CM GG MARIO LUIGI;VIRUS;141;12;30;5;CMCMGG00275;1;
Camisa ;com manga;MARSHALL;P;Instrumentos Musicais;;Marshall;CAMISA CM P MARSHALL;EQ;453;11;30;6;CMCMP00091;1;
Camisa ;com manga;MARSHALL;M;Instrumentos Musicais;;Marshall;CAMISA CM M MARSHALL;EQ;453;10,5;24;12;CMCMM00091;1;
Camisa ;com manga;MARSHALL;G;Instrumentos Musicais;;Marshall;CAMISA CM G MARSHALL;EQ;453;11;30;15;CMCMG00088;1;
Camisa ;com manga;MASCULINA;G;;;Masculina;CAMISA MASCULINA;AN;;12;30;0;CMCMG00397;1;
Camisa ;com manga;MASCULINA;G;;;Masculina;CAMISA CM G CAMISA MASCULINA;AN;;13;30;0;CMCMG00423;1;
Camisa ;com manga;MAYHEM;P;Mayhem;;Mayhem;CAMISA CM P MAYHEM;EQ;361;11;30;-1;CMCMP00068;1;
Camisa ;com manga;MAYHEM;M;Mayhem;;Mayhem;CAMISA CM M MAYHEM;EQ;361;10,5;24;0;CMCMM00068;1;
Camisa ;com manga;MAYHEM;G;Mayhem;;Mayhem;CAMISA CM G MAYHEM;EQ;361;10,5;24;0;CMCMG00068;1;
Camisa ;com manga;MAYHEM AZUL;P;Mayhem;;Mayhem Azul;CAMISA CM P MAYHEM AZUL;EQ;353;10,5;30;16;CMCMP00062;1;
Camisa ;com manga;MAYHEM AZUL;M;Mayhem;;Mayhem Azul;CAMISA CM M MAYHEM AZUL;EQ;353;10,5;30;16;CMCMM00062;1;
Camisa ;com manga;MAYHEM AZUL;G;Mayhem;;Mayhem Azul;CAMISA CM G MAYHEM AZUL;EQ;353;10,5;30;15;CMCMG00062;1;
Camisa ;com manga;MEGADETH BOMBA;M;Megadeth;;Megadeth Bomba;CAMISA CM M MEGADETH BOMBA;VIRUS;91;12,5;30;2;CMCMM00196;1;
Camisa ;com manga;MEGADETH BOMBA;G;Megadeth;;Megadeth Bomba;CAMISA CM G MEGADETH BOMBA;VIRUS;91;12,5;30;5;CMCMG00194;1;
Camisa ;com manga;MEGADETH BOMBA;GG;Megadeth;;Megadeth Bomba;CAMISA CM GG MEGADETH BOMBA;VIRUS;91;12,5;30;5;CMCMGG00134;1;
Camisa ;com manga;MEGADETH BOMBA;XGG;Megadeth;;Megadeth Bomba;CAMISA CM XGG MEGADETH BOMBA;VIRUS;91;12;30;6;CMCMXGG00015;1;
Camisa ;com manga;MEGADETH CAVEIRA;M;Megadeth;;Megadeth Caveira;CAMISA CM M MEGADETH CAVEIRA;VIRUS;54;12,5;30;0;CMCMM00190;1;
Camisa ;com manga;MEGADETH CAVEIRA;G;Megadeth;;Megadeth Caveira;CAMISA CM G MEGADETH CAVEIRA;VIRUS;54;12,5;30;0;CMCMG00188;1;
Camisa ;com manga;MEGADETH CAVEIRA;GG;Megadeth;;Megadeth Caveira;CAMISA CM GG MEGADETH CAVEIRA;VIRUS;54;12,5;30;0;CMCMGG00126;1;
Camisa ;com manga;MEGADETH CAVEIRA MASTER;M;Megadeth;;Megadeth Caveira Master;CAMISA CM M MEGADETH CAVEIRA MASTER;MR;172;12;30;13;CMCMM00359;1;
Camisa ;com manga;MEGADETH CAVEIRA MASTER;G;Megadeth;;Megadeth Caveira Master;CAMISA CM G MEGADETH CAVEIRA MASTER;MR;172;12;30;10;CMCMG00367;1;
Camisa ;com manga;MEGADETH CAVEIRA MASTER;GG;Megadeth;;Megadeth Caveira Master;CAMISA CM GG MEGADETH CAVEIRA MASTER;MR;172;12;30;7;CMCMGG00284;1;
Camisa ;com manga;MEGADETH CAVEIRA PROFANUS;M;Megadeth;;Megadeth Caveira Profanus;CAMISA CM M MEGADETH CAVEIRA PROFANUS;PROFANUS;289;12,5;30;0;CMCMM00223;1;
Camisa ;com manga;MEGADETH CAVEIRA PROFANUS;G;Megadeth;;Megadeth Caveira Profanus;CAMISA CM G MEGADETH CAVEIRA PROFANUS;PROFANUS;289;12,5;30;4;CMCMG00224;1;
Camisa ;com manga;MEGADETH CAVEIRA PROFANUS;GG;Megadeth;;Megadeth Caveira Profanus;CAMISA CM GG MEGADETH CAVEIRA PROFANUS;PROFANUS;289;12,5;30;14;CMCMGG00158;1;
Camisa ;com manga;MEGADETH RUST;P;Megadeth;;Megadeth Rust;CAMISA CM P MEGADETH RUST;MR;192;12;30;3;CMCMP00310;1;
Camisa ;com manga;MEGADETH RUST;M;Megadeth;;Megadeth Rust;CAMISA CM M MEGADETH RUST;MR;192;12;30;6;CMCMM00374;1;
Camisa ;com manga;MEGADETH RUST;G;Megadeth;;Megadeth Rust;CAMISA CM G MEGADETH RUST;MR;192;12;30;7;CMCMG00382;1;
Camisa ;com manga;MEGADETH RUST;GG;Megadeth;;Megadeth Rust;CAMISA CM GG MEGADETH RUST;MR;192;12;30;4;CMCMGG00300;1;
Camisa ;com manga;MERCYFUL FATE;M;Mercyful Fate;;Mercyful Fate;CAMISA CM M MERCYFUL FATE;BLACK ANGE;37;12,5;30;7;CMCMM00244;1;
Camisa ;com manga;MERCYFUL FATE;G;Mercyful Fate;;Mercyful Fate;CAMISA CM G MERCYFUL FATE;BLACK ANGE;39;12,5;30;6;CMCMG00246;1;
Camisa ;com manga;MERCYFUL FATE;GG;Mercyful Fate;;Mercyful Fate;CAMISA CM GG MERCYFUL FATE;BLACK ANGE;39;12,5;30;4;CMCMGG00179;1;
Camisa ;com manga;METALLICA COBRA;P;Metallica;;Metallica Cobra;CAMISA CM P METALLICA COBRA;EQ;69;10,5;30;12;CMCMP00012;1;
Camisa ;com manga;METALLICA COBRA;M;Metallica;;Metallica Cobra;CAMISA CM M METALLICA COBRA;EQ;69;11;30;8;CMCMM00011;1;
Camisa ;com manga;METALLICA COBRA;G;Metallica;;Metallica Cobra;CAMISA CM G METALLICA COBRA;EQ;69;11;30;7;CMCMG00012;1;
Camisa ;com manga;METALLICA COBRA;GG;Metallica;;Metallica Cobra;CAMISA CM GG METALLICA COBRA;EQ;69;10,5;24;6;CMCMGG00009;1;
Camisa ;com manga;METALLICA DEATH MAGNETIC BRANCA;P;Metallica;;Metallica Death Magnetic Branca;CAMISA CM P METALLICA DEATH MAGNETIC BRANCA;MR;179;12,5;30;5;CMCMP00219;1;
Camisa ;com manga;METALLICA DEATH MAGNETIC BRANCA;M;Metallica;;Metallica Death Magnetic Branca;CAMISA CM M METALLICA DEATH MAGNETIC BRANCA;MR;179;12,5;30;1;CMCMM00293;1;
Camisa ;com manga;METALLICA DEATH MAGNETIC BRANCA;G;Metallica;;Metallica Death Magnetic Branca;CAMISA CM G METALLICA DEATH MAGNETIC BRANCA;MR;179;12,5;30;4;CMCMG00295;1;
Camisa ;com manga;METALLICA DEATH MAGNETIC BRANCA;GG;Metallica;;Metallica Death Magnetic Branca;CAMISA CM GG METALLICA DEATH MAGNETIC BRANCA;MR;179;12,5;30;13;CMCMGG00216;1;
Camisa ;com manga;METALLICA DEATH MAGNETIC PRETA;P;Metallica;;Metallica Death Magnetic Preta;CAMISA CM P METALLICA DEATH MAGNETIC PRETA;MR;173;11,5;30;4;CMCMP00243;1;
Camisa ;com manga;METALLICA DEATH MAGNETIC PRETA;M;Metallica;;Metallica Death Magnetic Preta;CAMISA CM M METALLICA DEATH MAGNETIC PRETA;MR;173;12,5;30;3;CMCMM00292;1;
Camisa ;com manga;METALLICA DEATH MAGNETIC PRETA;G;Metallica;;Metallica Death Magnetic Preta;CAMISA CM G METALLICA DEATH MAGNETIC PRETA;MR;173;12,5;30;3;CMCMG00294;1;
Camisa ;com manga;METALLICA DEATH MAGNETIC PRETA;GG;Metallica;;Metallica Death Magnetic Preta;CAMISA CM GG METALLICA DEATH MAGNETIC PRETA;MR;173;12,5;30;4;CMCMGG00215;1;
Camisa ;com manga;METALLICA DEATH MAGNETIC VIRUS;P;Metallica;;Metallica Death Magnetic Virus;CAMISA CM P METALLICA DEATH MAGNETIC VIRUS;VIRUS;96;13;30;0;CMCMP00337;1;
Camisa ;com manga;METALLICA DEATH MAGNETIC VIRUS;M;Metallica;;Metallica Death Magnetic Virus;CAMISA CM M METALLICA DEATH MAGNETIC VIRUS;VIRUS;96;13;30;5;CMCMM00406;1;
Camisa ;com manga;METALLICA DEATH MAGNETIC VIRUS;G;Metallica;;Metallica Death Magnetic Virus;CAMISA CM G METALLICA DEATH MAGNETIC VIRUS;VIRUS;96;13;30;9;CMCMG00416;1;
Camisa ;com manga;METALLICA DEATH MAGNETIC VIRUS;GG;Metallica;;Metallica Death Magnetic Virus;CAMISA CM GG METALLICA DEATH MAGNETIC VIRUS;VIRUS;96;13;30;8;CMCMGG00328;1;
Camisa ;com manga;METALLICA JUSTICE BRANCA;P;Metallica;;Metallica Justice Branca;CAMISA CM P METALLICA JUSTICE BRANCA;VIRUS;113;12,5;30;8;CMCMP00191;1;
Camisa ;com manga;METALLICA JUSTICE BRANCA;M;Metallica;;Metallica Justice Branca;CAMISA CM M METALLICA JUSTICE BRANCA;VIRUS;113;12,5;30;13;CMCMM00201;1;
Camisa ;com manga;METALLICA JUSTICE BRANCA;G;Metallica;;Metallica Justice Branca;CAMISA CM G METALLICA JUSTICE BRANCA;VIRUS;113;12,5;30;13;CMCMG00199;1;
Camisa ;com manga;METALLICA JUSTICE BRANCA;GG;Metallica;;Metallica Justice Branca;CAMISA CM GG METALLICA JUSTICE BRANCA;VIRUS;113;12,5;30;16;CMCMGG00133;1;
Camisa ;com manga;METALLICA JUSTICE BRANCA;XGG;Metallica;;Metallica Justice Branca;CAMISA CM XGG METALLICA JUSTICE BRANCA;VIRUS;113;13;30;6;CMCMXGG00048;1;
Camisa ;com manga;METALLICA JUSTICE PRETA;P;Metallica;;Metallica Justice Preta;CAMISA CM P METALLICA JUSTICE PRETA;VIRUS;112;12;30;15;CMCMP00317;1;
Camisa ;com manga;METALLICA JUSTICE PRETA;M;Metallica;;Metallica Justice Preta;CAMISA CM M METALLICA JUSTICE PRETA;VIRUS;112;12;30;7;CMCMM00381;1;
Camisa ;com manga;METALLICA JUSTICE PRETA;G;Metallica;;Metallica Justice Preta;CAMISA CM G METALLICA JUSTICE PRETA;VIRUS;112;12;30;11;CMCMG00389;1;
Camisa ;com manga;METALLICA JUSTICE PRETA;GG;Metallica;;Metallica Justice Preta;CAMISA CM GG METALLICA JUSTICE PRETA;VIRUS;112;12;30;12;CMCMGG00307;1;
Camisa ;com manga;METALLICA KILL;P;Metallica;;Metallica Kill;CAMISA CM P METALLICA KILL;VIRUS;63;12;30;14;CMCMP00252;1;
Camisa ;com manga;METALLICA KILL;M;Metallica;;Metallica Kill;CAMISA CM M METALLICA KILL;VIRUS;63;12,5;30;0;CMCMM00192;1;
Camisa ;com manga;METALLICA KILL;G;Metallica;;Metallica Kill;CAMISA CM G METALLICA KILL;VIRUS;63;12,5;30;5;CMCMG00190;1;
Camisa ;com manga;METALLICA KILL;GG;Metallica;;Metallica Kill;CAMISA CM GG METALLICA KILL;VIRUS;63;12,5;30;6;CMCMGG00128;1;
Camisa ;com manga;METALLICA MASTER ALBUM;P;Metallica;;Metallica Master Album;CAMISA CM P METALLICA MASTER ALBUM;VIRUS;111;12;30;6;CMCMP00321;1;
Camisa ;com manga;METALLICA MASTER ALBUM;M;Metallica;;Metallica Master Album;CAMISA CM M METALLICA MASTER ALBUM;VIRUS;111;12,5;30;6;CMCMM00238;1;
Camisa ;com manga;METALLICA MASTER ALBUM;G;Metallica;;Metallica Master Album;CAMISA CM G METALLICA MASTER ALBUM;VIRUS;111;12,5;30;6;CMCMG00239;1;
Camisa ;com manga;METALLICA MASTER ALBUM;GG;Metallica;;Metallica Master Album;CAMISA CM GG METALLICA MASTER ALBUM;VIRUS;111;12,5;30;7;CMCMGG00173;1;
Camisa ;com manga;METALLICA MASTER ALBUM;XGG;Metallica;;Metallica Master Album;CAMISA CM XGG METALLICA MASTER ALBUM;VIRUS;111;13;30;9;CMCMXGG00009;1;
Camisa ;com manga;METALLICA MASTER ROCK;P;Metallica;;Metallica Master Rock;CAMISA CM P METALLICA MASTER ROCK;MR;201;12;30;4;CMCMP00307;1;
Camisa ;com manga;METALLICA MASTER ROCK;M;Metallica;;Metallica Master Rock;CAMISA CM M METALLICA MASTER ROCK;MR;201;12;30;3;CMCMM00371;1;
Camisa ;com manga;METALLICA MASTER ROCK;G;Metallica;;Metallica Master Rock;CAMISA CM G METALLICA MASTER ROCK;MR;201;12;30;12;CMCMG00379;1;
Camisa ;com manga;METALLICA MASTER ROCK;GG;Metallica;;Metallica Master Rock;CAMISA CM GG METALLICA MASTER ROCK;MR;201;12;30;4;CMCMGG00297;1;
Camisa ;com manga;METALLICA RIDE;P;Metallica;;Metallica Ride;CAMISA CM P METALLICA RIDE;VIRUS;6;12,5;30;6;CMCMP00176;1;
Camisa ;com manga;METALLICA RIDE;M;Metallica;;Metallica Ride;CAMISA CM M METALLICA RIDE;VIRUS;6;12,5;30;11;CMCMM00172;1;
Camisa ;com manga;METALLICA RIDE;G;Metallica;;Metallica Ride;CAMISA CM G METALLICA RIDE;VIRUS;6;12,5;30;0;CMCMG00170;1;
Camisa ;com manga;METALLICA RIDE;GG;Metallica;;Metallica Ride;CAMISA CM GG METALLICA RIDE;VIRUS;6;12,5;30;4;CMCMGG00112;1;
Camisa ;com manga;METALLICA RIDE;XGG;Metallica;;Metallica Ride;CAMISA CM XGG METALLICA RIDE;VIRUS;6;12;30;7;CMCMXGG00019;1;
Camisa ;com manga;METALLICA ST ANGER PUNHO;P;Metallica;;Metallica St Anger Punho;CAMISA CM P METALLICA ST ANGER PUNHO;EQ;407;10,5;30;9;CMCMP00079;1;
Camisa ;com manga;METALLICA ST ANGER PUNHO;M;Metallica;;Metallica St Anger Punho;CAMISA CM M METALLICA ST ANGER PUNHO;EQ;407;10,5;30;5;CMCMM00078;1;
Camisa ;com manga;METALLICA ST ANGER PUNHO;G;Metallica;;Metallica St Anger Punho;CAMISA CM G METALLICA ST ANGER PUNHO;EQ;407;10,5;30;8;CMCMG00077;1;
Camisa ;com manga;METALLICA ST ANGER PUNHO;GG;Metallica;;Metallica St Anger Punho;CAMISA CM GG METALLICA ST ANGER PUNHO;EQ;407;11;30;6;CMCMGG00043;1;
Camisa ;com manga;MEXICANA TATTOO;P;Tattoo;;Mexicana Tattoo;CAMISA CM P MEXICANA TATTOO;HCD;288;12,5;30;5;CMCMP00204;1;
Camisa ;com manga;MEXICANA TATTOO;M;Tattoo;;Mexicana Tattoo;CAMISA CM M MEXICANA TATTOO;HCD;288;12,5;30;8;CMCMM00261;1;
Camisa ;com manga;MEXICANA TATTOO;G;Tattoo;;Mexicana Tattoo;CAMISA CM G MEXICANA TATTOO;HCD;288;12,5;30;3;CMCMG00262;1;
Camisa ;com manga;MEXICANA TATTOO;GG;Tattoo;;Mexicana Tattoo;CAMISA CM GG MEXICANA TATTOO;HCD;288;11;30;9;CMCMGG00261;1;
Camisa ;com manga;MEXICANA TATTOO;XGG;Tattoo;;Mexicana Tattoo;CAMISA CM XGG MEXICANA TATTOO;HCD;288;15;36;0;CMCMXGG00044;1;
Camisa ;com manga;MISFITS LEGACY;M;Misfits;;Misfits Legacy;CAMISA CM M MISFITS LEGACY;EQ;596;10,5;24;0;CMCMM00103;;
Camisa ;com manga;MISFITS ROXA;P;Misfits;;Misfits Roxa;CAMISA CM P MISFITS ROXA;EQ;602;10,5;24;0;CMCMP00109;1;
Camisa ;com manga;MISFITS ROXA;M;Misfits;;Misfits Roxa;CAMISA CM M MISFITS ROXA;EQ;602;10,5;30;0;CMCMM00107;1;
Camisa ;com manga;MISFITS ROXA;G;Misfits;;Misfits Roxa;CAMISA CM G MISFITS ROXA;EQ;602;11;30;3;CMCMG00105;1;
Camisa ;com manga;MISFITS VERDE;P;Misfits;;Misfits Verde;CAMISA CM P MISFITS VERDE;EQ;72;10,5;30;6;CMCMP00013;1;
Camisa ;com manga;MISFITS VERDE;M;Misfits;;Misfits Verde;CAMISA CM M MISFITS VERDE;EQ;72;10,5;30;7;CMCMM00012;1;
Camisa ;com manga;MISFITS VERDE;G;Misfits;;Misfits Verde;CAMISA CM G MISFITS VERDE;EQ;72;11;30;8;CMCMG00013;1;
Camisa ;com manga;MISFITS VERDE;GG;Misfits;;Misfits Verde;CAMISA CM GG MISFITS VERDE;EQ;72;11;30;5;CMCMGG00010;1;
Camisa ;com manga;MORBID ANGEL ALTARS;M;Morbid Angel;;Morbid Angel Altars;CAMISA CM M MORBID ANGEL ALTARS;BLACK ANGE;72;12;30;0;CMCMM00347;1;
Camisa ;com manga;MORBID ANGEL ALTARS;G;Morbid Angel;;Morbid Angel Altars;CAMISA CM G MORBID ANGEL ALTARS;BLACK ANGE;72;12;30;12;CMCMG00354;1;
Camisa ;com manga;MORBID ANGEL ALTARS;GG;Morbid Angel;;Morbid Angel Altars;CAMISA CM GG MORBID ANGEL ALTARS;BLACK ANGE;72;12;30;7;CMCMGG00273;1;
Camisa ;com manga;MORBID ANGEL LOGO;M;Morbid Angel;;Morbid Angel Logo;CAMISA CM M MORBID ANGEL LOGO;PROFANUS;26;12,5;30;8;CMCMM00203;1;
Camisa ;com manga;MORBID ANGEL LOGO;G;Morbid Angel;;Morbid Angel Logo;CAMISA CM G MORBID ANGEL LOGO;PROFANUS;26;12,5;30;12;CMCMG00201;1;
Camisa ;com manga;MORBID ANGEL LOGO;GG;Morbid Angel;;Morbid Angel Logo;CAMISA CM GG MORBID ANGEL LOGO;PROFANUS;26;12,5;30;4;CMCMGG00138;1;
Camisa ;com manga;MOTO INDIAN;P;Moto Indian;;Moto Indian;CAMISA CM P MOTO INDIAN;HCD;304;12;30;8;CMCMP00291;1;
Camisa ;com manga;MOTO INDIAN;M;Moto Indian;;Moto Indian;CAMISA CM M MOTO INDIAN;HCD;304;12;30;1;CMCMM00352;1;
Camisa ;com manga;MOTO INDIAN;G;Moto Indian;;Moto Indian;CAMISA CM G MOTO INDIAN;HCD;304;12;30;0;CMCMG00359;1;
Camisa ;com manga;MOTO INDIAN;GG;Moto Indian;;Moto Indian;CAMISA CM GG MOTO INDIAN;HCD;304;12;30;0;CMCMGG00277;1;
Camisa ;com manga;MOTORHEAD KISS OF DEATH;M;Motorhead;;Motorhead Kiss Of Death;CAMISA CM M MOTORHEAD KISS OF DEATH;PROFANUS;279;12,5;30;0;CMCMM00219;1;
Camisa ;com manga;MOTORHEAD KISS OF DEATH;G;Motorhead;;Motorhead Kiss Of Death;CAMISA CM G MOTORHEAD KISS OF DEATH;PROFANUS;279;12,5;30;0;CMCMG00220;1;
Camisa ;com manga;MOTORHEAD KISS OF DEATH;GG;Motorhead;;Motorhead Kiss Of Death;CAMISA CM GG MOTORHEAD KISS OF DEATH;PROFANUS;279;12,5;30;0;CMCMGG00154;1;
Camisa ;com manga;MOTORHEAD TRADICIONAL;P;Motorhead;;Motorhead Tradicional;CAMISA CM P MOTORHEAD TRADICIONAL;EQ;430;10,5;30;10;CMCMP00084;1;
Camisa ;com manga;MOTORHEAD TRADICIONAL;M;Motorhead;;Motorhead Tradicional;CAMISA CM M MOTORHEAD TRADICIONAL;EQ;430;11;30;3;CMCMM00083;1;
Camisa ;com manga;MOTORHEAD TRADICIONAL;G;Motorhead;;Motorhead Tradicional;CAMISA CM G MOTORHEAD TRADICIONAL;EQ;430;11;30;8;CMCMG00082;1;
Camisa ;com manga;MOTORHEAD TRADICIONAL;GG;Motorhead;;Motorhead Tradicional;CAMISA CM GG MOTORHEAD TRADICIONAL;EQ;430;11;30;0;CMCMGG00044;1;
Camisa ;com manga;NARUTO BRANCA VIRUS;P;Naruto;;Naruto Branca Virus;CAMISA CM P NARUTO BRANCA VIRUS;VIRUS;134;12;30;0;CMCMP00290;1;
