Camisa ;com manga;CAVEIRA TRONO;GG;Caveira;;Caveira Trono;CAMISA CM GG CAVEIRA TRONO;HCD;256;12,5;30;3;CMCMGG00110;1;
Camisa ;com manga;CHUCKY;P;Terror;;Chucky;CAMISA CM P CHUCKY;HCD;166;12,5;30;9;CMCMP00168;1;
Camisa ;com manga;CHUCKY;M;Terror;;Chucky;CAMISA CM M CHUCKY;HCD;166;12,5;30;7;CMCMM00165;1;
Camisa ;com manga;CHUCKY;G;Terror;;Chucky;CAMISA CM G CHUCKY;HCD;166;12,5;30;4;CMCMG00162;1;
Camisa ;com manga;CHUCKY;GG;Terror;;Chucky;CAMISA CM GG CHUCKY;HCD;166;12,5;30;0;CMCMGG00105;1;
Camisa ;com manga;CHUCKY;XGG;Terror;;Chucky;CAMISA CM XGG CHUCKY;HCD;166;15;36;0;CMCMXGG00031;1;
Camisa ;com manga;CM G;G;;;Cm G;CAMISA CM G;HCD;278;12,5;30;0;CMCMG00164;1;
Camisa ;com manga;CM G;G;;;Cm G;CAMISA CM G;;;13;30;0;CMCMG00422;1;
Camisa ;com manga;CM M;M;;;Cm M;CAMISA CM M;BLACK ANGE;5;12,5;30;-4;CMCMM00246;;
Camisa ;com manga;CM P;P;;;Cm P;CAMISA CM P;HCD;230;12,5;30;0;CMCMP00147;;
Camisa ;com manga;CORINGA CABELO VERDE;P;Quadrinhos;;Coringa Cabelo Verde;CAMISA CM P CORINGA CABELO VERDE;HCD;198;12,5;30;0;CMCMP00158;1;
Camisa ;com manga;CORINGA CABELO VERDE;M;Quadrinhos;;Coringa Cabelo Verde;CAMISA CM M CORINGA CABELO VERDE;HCD;198;12,5;30;0;CMCMM00153;1;
Camisa ;com manga;CORINGA CABELO VERDE;G;Quadrinhos;;Coringa Cabelo Verde;CAMISA CM G CORINGA CABELO VERDE;HCD;198;12,5;30;0;CMCMG00147;1;
Camisa ;com manga;CORINGA CABELO VERDE;GG;Quadrinhos;;Coringa Cabelo Verde;CAMISA CM GG CORINGA CABELO VERDE;HCD;198;12,5;30;0;CMCMGG00090;1;
Camisa ;com manga;CORINGA CARTA;P;Quadrinhos;;Coringa Carta;CAMISA CM P CORINGA CARTA;MR;144;12,5;30;4;CMCMP00218;1;
Camisa ;com manga;CORINGA CARTA;M;Quadrinhos;;Coringa Carta;CAMISA CM M CORINGA CARTA;MR;144;12,5;30;2;CMCMM00291;1;
Camisa ;com manga;CORINGA CARTA;G;Quadrinhos;;Coringa Carta;CAMISA CM G CORINGA CARTA;MR;144;12,5;30;1;CMCMG00293;1;
Camisa ;com manga;CORINGA CARTA;GG;Quadrinhos;;Coringa Carta;CAMISA CM GG CORINGA CARTA;MR;144;12,5;30;2;CMCMGG00214;1;
Camisa ;com manga;DARK SIDE VADER;P;Pink Floyd;;Dark Side Vader;CAMISA CM P DARK SIDE VADER;EQ;791;11;30;6;CMCMP00144;1;
Camisa ;com manga;DARK SIDE VADER;M;Pink Floyd;;Dark Side Vader;CAMISA CM M DARK SIDE VADER;EQ;791;11;30;9;CMCMM00143;1;
Camisa ;com manga;DARK SIDE VADER;G;Pink Floyd;;Dark Side Vader;CAMISA CM G DARK SIDE VADER;EQ;791;11;30;8;CMCMG00152;1;
Camisa ;com manga;DARK SIDE VADER;GG;Pink Floyd;;Dark Side Vader;CAMISA CM GG DARK SIDE VADER;EQ;791;11;30;8;CMCMGG00082;1;
Camisa ;com manga;DARK THRONE;P;Darkthrone;;Dark Throne;CAMISA CM P DARK THRONE;EQ;387;10,5;30;2;CMCMP00075;1;
Camisa ;com manga;DARK THRONE;M;Darkthrone;;Dark Throne;CAMISA CM M DARK THRONE;EQ;387;11;30;4;CMCMM00074;1;
Camisa ;com manga;DARK THRONE;G;Darkthrone;;Dark Throne;CAMISA CM G DARK THRONE;EQ;387;11;30;3;CMCMG00073;1;
Camisa ;com manga;DARTH VADER BRANCA;P;Star Wars;;Darth Vader Branca;CAMISA CM P DARTH VADER BRANCA;HCD;208;12,5;30;5;CMCMP00150;1;
Camisa ;com manga;DARTH VADER BRANCA;M;Star Wars;;Darth Vader Branca;CAMISA CM M DARTH VADER BRANCA;HCD;208;12,5;30;0;CMCMM00150;1;
Camisa ;com manga;DARTH VADER BRANCA;G;Star Wars;;Darth Vader Branca;CAMISA CM G DARTH VADER BRANCA;HCD;208;12,5;30;5;CMCMG00151;1;
Camisa ;com manga;DARTH VADER BRANCA;GG;Star Wars;;Darth Vader Branca;CAMISA CM GG DARTH VADER BRANCA;HCD;208;12,5;30;6;CMCMGG00095;1;
Camisa ;com manga;DARTH VADER BRANCA;XGG;Star Wars;;Darth Vader Branca;CAMISA CM XGG DARTH VADER BRANCA;HCD;208;15;36;3;CMCMXGG00032;1;
Camisa ;com manga;DAVID CAVEIRA;P;David Bowie;;David Caveira;CAMISA CM P DAVID CAVEIRA;HCD;270;12,5;30;7;CMCMP00161;1;
Camisa ;com manga;DAVID CAVEIRA;M;David Bowie;;David Caveira;CAMISA CM M DAVID CAVEIRA;HCD;270;12,5;30;5;CMCMM00158;1;
Camisa ;com manga;DAVID CAVEIRA;G;David Bowie;;David Caveira;CAMISA CM G DAVID CAVEIRA;HCD;270;12,5;30;6;CMCMG00155;1;
Camisa ;com manga;DAVID CAVEIRA;GG;David Bowie;;David Caveira;CAMISA CM GG DAVID CAVEIRA;HCD;270;12,5;30;15;CMCMGG00098;1;
Camisa ;com manga;DAVID ROSTO;P;Caveira;;David Rosto;CAMISA CM P DAVID ROSTO;HCD;316;12;30;9;CMCMP00319;1;
Camisa ;com manga;DAVID ROSTO;M;Caveira;;David Rosto;CAMISA CM M DAVID ROSTO;HCD;316;12;30;3;CMCMM00387;1;
Camisa ;com manga;DAVID ROSTO;G;Caveira;;David Rosto;CAMISA CM G DAVID ROSTO;HCD;316;12;30;6;CMCMG00395;1;
Camisa ;com manga;DAVID ROSTO;GG;Caveira;;David Rosto;CAMISA CM GG DAVID ROSTO;HCD;316;12;30;6;CMCMGG00313;1;
Camisa ;com manga;DEATH LOGO;M;Death;;Death Logo;CAMISA CM M DEATH LOGO;PROFANUS;28;12,5;30;1;CMCMM00204;1;
Camisa ;com manga;DEATH LOGO;G;Death;;Death Logo;CAMISA CM G DEATH LOGO;PROFANUS;28;12,5;30;4;CMCMG00205;1;
Camisa ;com manga;DEATH LOGO;GG;Death;;Death Logo;CAMISA CM GG DEATH LOGO;PROFANUS;28;12,5;30;9;CMCMGG00139;1;
Camisa ;com manga;DEATH NOTE BRANCA VIRUS;P;Death Note;;Death Note Branca Virus;CAMISA CM P DEATH NOTE BRANCA VIRUS;VIRUS;137;12;30;11;CMCMP00288;1;
Camisa ;com manga;DEATH NOTE BRANCA VIRUS;M;Death Note;;Death Note Branca Virus;CAMISA CM M DEATH NOTE BRANCA VIRUS;VIRUS;137;12;30;7;CMCMM00349;1;
Camisa ;com manga;DEATH NOTE BRANCA VIRUS;G;Death Note;;Death Note Branca Virus;CAMISA CM G DEATH NOTE BRANCA VIRUS;VIRUS;137;12;30;11;CMCMG00356;1;
Camisa ;com manga;DEATH NOTE BRANCA VIRUS;GG;Death Note;;Death Note Branca Virus;CAMISA CM GG DEATH NOTE BRANCA VIRUS;VIRUS;137;13;30;11;CMCMGG00295;1;
Camisa ;com manga;DEATH NOTE PRETA HCD;P;Death Note;;Death Note Preta Hcd;CAMISA CM P DEATH NOTE PRETA HCD;HCD;296;12;30;8;CMCMP00293;1;
Camisa ;com manga;DEATH NOTE PRETA HCD;M;Death Note;;Death Note Preta Hcd;CAMISA CM M DEATH NOTE PRETA HCD;HCD;296;12;30;5;CMCMM00354;1;
Camisa ;com manga;DEATH NOTE PRETA HCD;G;Death Note;;Death Note Preta Hcd;CAMISA CM G DEATH NOTE PRETA HCD;HCD;296;12;30;16;CMCMG00362;1;
Camisa ;com manga;DEATH NOTE PRETA HCD;GG;Death Note;;Death Note Preta Hcd;CAMISA CM GG DEATH NOTE PRETA HCD;HCD;296;12;30;8;CMCMGG00279;1;
Camisa ;com manga;DEATH NOTE PRETA HCD;XGG;Death Note;;Death Note Preta Hcd;CAMISA CM XGG DEATH NOTE PRETA HCD;HCD;296;15;36;0;CMCMXGG00033;1;
Camisa ;com manga;DEEP PURPLE IN ROCK;M;Deep Purple;;Deep Purple In Rock;CAMISA CM M DEEP PURPLE IN ROCK;PROFANUS;367;12;30;0;CMCMM00329;1;
Camisa ;com manga;DEEP PURPLE IN ROCK;G;Deep Purple;;Deep Purple In Rock;CAMISA CM G DEEP PURPLE IN ROCK;PROFANUS;367;12;30;0;CMCMG00332;1;
Camisa ;com manga;DEEP PURPLE IN ROCK;GG;Deep Purple;;Deep Purple In Rock;CAMISA CM GG DEEP PURPLE IN ROCK;PROFANUS;367;12;30;0;CMCMGG00252;1;
Camisa ;com manga;DEF LEPPARD PYROMANIA;M;Def Leppard;;Def Leppard Pyromania;CAMISA CM M DEF LEPPARD PYROMANIA;PROFANUS;343;12,5;30;16;CMCMM00236;1;
Camisa ;com manga;DEF LEPPARD PYROMANIA;G;Def Leppard;;Def Leppard Pyromania;CAMISA CM G DEF LEPPARD PYROMANIA;PROFANUS;343;12,5;30;17;CMCMG00237;1;
Camisa ;com manga;DEF LEPPARD PYROMANIA;GG;Def Leppard;;Def Leppard Pyromania;CAMISA CM GG DEF LEPPARD PYROMANIA;PROFANUS;343;12,5;30;16;CMCMGG00171;1;
Camisa ;com manga;DEICEIDE TO HELL;M;Deicide;;Deiceide To Hell;CAMISA CM M DEICEIDE TO HELL;BLACK ANGE;13;12,5;30;3;CMCMM00250;1;
Camisa ;com manga;DEICEIDE TO HELL;G;Deicide;;Deiceide To Hell;CAMISA CM G DEICEIDE TO HELL;BLACK ANGE;13;12,5;30;5;CMCMG00252;1;
Camisa ;com manga;DEICEIDE TO HELL;GG;Deicide;;Deiceide To Hell;CAMISA CM GG DEICEIDE TO HELL;BLACK ANGE;13;12,5;30;10;CMCMGG00185;1;
Camisa ;com manga;DESTRUCTION;M;Destruction;;Destruction;CAMISA CM M DESTRUCTION;BLACK ANGE;37;12,5;30;0;CMCMM00241;1;
Camisa ;com manga;DESTRUCTION;G;Destruction;;Destruction;CAMISA CM G DESTRUCTION;BLACK ANGE;37;12,5;30;0;CMCMG00243;1;
Camisa ;com manga;DESTRUCTION;GG;Destruction;;Destruction;CAMISA CM GG DESTRUCTION;BLACK ANGE;37;12,5;30;-2;CMCMGG00176;1;
Camisa ;com manga;DIMMU BORGIR PENTAGRAMA;P;Dimmu Borgir;;Dimmu Borgir Pentagrama;CAMISA CM P DIMMU BORGIR PENTAGRAMA;EQ;418;10,5;30;2;CMCMP00082;1;
Camisa ;com manga;DIMMU BORGIR PENTAGRAMA;M;Dimmu Borgir;;Dimmu Borgir Pentagrama;CAMISA CM M DIMMU BORGIR PENTAGRAMA;EQ;418;11;30;4;CMCMM00081;1;
Camisa ;com manga;DIMMU BORGIR PENTAGRAMA;G;Dimmu Borgir;;Dimmu Borgir Pentagrama;CAMISA CM G DIMMU BORGIR PENTAGRAMA;EQ;418;10,5;30;7;CMCMG00080;1;
Camisa ;com manga;DIO HOLY DIVER;M;Dio;;Dio Holy Diver;CAMISA CM M DIO HOLY DIVER;BLACK ANGE;60;12;30;8;CMCMM00346;1;
Camisa ;com manga;DIO HOLY DIVER;G;Dio;;Dio Holy Diver;CAMISA CM G DIO HOLY DIVER;BLACK ANGE;60;12;30;5;CMCMG00353;1;
Camisa ;com manga;DIO HOLY DIVER;GG;Dio;;Dio Holy Diver;CAMISA CM GG DIO HOLY DIVER;BLACK ANGE;60;12;30;13;CMCMGG00272;1;
Camisa ;com manga;DIO HOLY DIVER;XGG;Dio;;Dio Holy Diver;CAMISA CM XGG DIO HOLY DIVER;BLACK ANGE;60;13;30;1;CMCMXGG00003;1;
Camisa ;com manga;DISTURBED;M;Disturbed;;Disturbed;CAMISA CM M DISTURBED;PROFANUS;311;12,5;30;1;CMCMM00229;1;
Camisa ;com manga;DISTURBED;G;Disturbed;;Disturbed;CAMISA CM G DISTURBED;PROFANUS;311;12,5;30;8;CMCMG00230;1;
Camisa ;com manga;DISTURBED;GG;Disturbed;;Disturbed;CAMISA CM GG DISTURBED;PROFANUS;311;12,5;30;8;CMCMGG00164;1;
Camisa ;com manga;DOORS AZUL;P;The Doors;;Doors Azul;CAMISA CM P DOORS AZUL;EQ;22;11;30;5;CMCMP00004;1;
Camisa ;com manga;DOORS AZUL;M;The Doors;;Doors Azul;CAMISA CM M DOORS AZUL;EQ;22;11;30;8;CMCMM00004;1;
Camisa ;com manga;DOORS AZUL;G;The Doors;;Doors Azul;CAMISA CM G DOORS AZUL;EQ;22;11;30;6;CMCMG00005;1;
Camisa ;com manga;DOORS AZUL;GG;The Doors;;Doors Azul;CAMISA CM GG DOORS AZUL;EQ;22;11;30;9;CMCMGG00003;1;
Camisa ;com manga;DOORS MORRISON BRANCA;M;The Doors;;Doors Morrison Branca;CAMISA CM M DOORS MORRISON BRANCA;VIRUS;59;12,5;30;0;CMCMM00191;1;
Camisa ;com manga;DOORS MORRISON BRANCA;G;The Doors;;Doors Morrison Branca;CAMISA CM G DOORS MORRISON BRANCA;VIRUS;20;12,5;30;0;CMCMG00175;1;
Camisa ;com manga;DOORS MORRISON BRANCA;GG;The Doors;;Doors Morrison Branca;CAMISA CM GG DOORS MORRISON BRANCA;VIRUS;59;12,5;30;0;CMCMGG00127;1;
Camisa ;com manga;DREAM THEATER AWAKEN;P;Dream Theater;;Dream Theater Awaken;CAMISA CM P DREAM THEATER AWAKEN;EQ;359;10,5;30;4;CMCMP00066;1;
Camisa ;com manga;DREAM THEATER AWAKEN;M;Dream Theater;;Dream Theater Awaken;CAMISA CM M DREAM THEATER AWAKEN;EQ;359;11;30;0;CMCMM00066;1;
Camisa ;com manga;DREAM THEATER AWAKEN;G;Dream Theater;;Dream Theater Awaken;CAMISA CM G DREAM THEATER AWAKEN;EQ;359;11;30;1;CMCMG00066;1;
Camisa ;com manga;DREAM THEATER BLACK CLOUDS;M;Dream Theater;;Dream Theater Black Clouds;CAMISA CM M DREAM THEATER BLACK CLOUDS;VIRUS;109;12,5;30;8;CMCMM00200;1;
Camisa ;com manga;DREAM THEATER BLACK CLOUDS;G;Dream Theater;;Dream Theater Black Clouds;CAMISA CM G DREAM THEATER BLACK CLOUDS;VIRUS;109;12,5;30;9;CMCMG00198;1;
Camisa ;com manga;DREAM THEATER BLACK CLOUDS;GG;Dream Theater;;Dream Theater Black Clouds;CAMISA CM GG DREAM THEATER BLACK CLOUDS;VIRUS;109;12,5;30;6;CMCMGG00136;1;
Camisa ;com manga;DREAM THEATER METROPOLIS;M;Dream Theater;;Dream Theater Metropolis;CAMISA CM M DREAM THEATER METROPOLIS;MR;20;12,5;30;7;CMCMM00263;1;
Camisa ;com manga;DREAM THEATER METROPOLIS;G;Dream Theater;;Dream Theater Metropolis;CAMISA CM G DREAM THEATER METROPOLIS;MR;20;12,5;30;9;CMCMG00264;1;
Camisa ;com manga;DREAM THEATER METROPOLIS;GG;Dream Theater;;Dream Theater Metropolis;CAMISA CM GG DREAM THEATER METROPOLIS;MR;20;12,5;30;11;CMCMGG00197;1;
Camisa ;com manga;DRI AZUL;M;DRI;;Dri Azul;CAMISA CM M DRI AZUL;BLACK ANGE;26;12,5;30;6;CMCMM00298;1;
Camisa ;com manga;DRI AZUL;G;DRI;;Dri Azul;CAMISA CM G DRI AZUL;BLACK ANGE;26;12,5;30;9;CMCMG00300;1;
Camisa ;com manga;DRI AZUL;GG;DRI;;Dri Azul;CAMISA CM GG DRI AZUL;BLACK ANGE;26;12,5;30;8;CMCMGG00221;1;
Camisa ;com manga;DRI BRANCA;M;DRI;;Dri Branca;CAMISA CM M DRI BRANCA;PROFANUS;227;12,5;30;8;CMCMM00212;1;
Camisa ;com manga;DRI BRANCA;G;DRI;;Dri Branca;CAMISA CM G DRI BRANCA;PROFANUS;227;12,5;30;8;CMCMG00213;1;
Camisa ;com manga;DRI BRANCA;GG;DRI;;Dri Branca;CAMISA CM GG DRI BRANCA;PROFANUS;227;12,5;30;7;CMCMGG00147;1;
Camisa ;com manga;ELVIS VIOLAO;P;Elvis Presley;;Elvis Violao;CAMISA CM P ELVIS VIOLAO;HCD;317;13,5;30;6;CMCMP00322;1;
Camisa ;com manga;ELVIS VIOLAO;M;Elvis Presley;;Elvis Violao;CAMISA CM M ELVIS VIOLAO;HCD;317;13,5;30;3;CMCMM00389;1;
Camisa ;com manga;ELVIS VIOLAO;G;Elvis Presley;;Elvis Violao;CAMISA CM G ELVIS VIOLAO;HCD;;13,5;30;0;CMCMG00398;1;
Camisa ;com manga;ELVIS VIOLAO;GG;Elvis Presley;;Elvis Violao;CAMISA CM GG ELVIS VIOLAO;HCD;317;13,5;30;4;CMCMGG00314;1;
Camisa ;com manga;ENGENHEIROS AZUL;P;Engenheiros do Hawaii;;Engenheiros Azul;CAMISA CM P ENGENHEIROS AZUL;EQ;751;10,5;30;7;CMCMP00121;1;
Camisa ;com manga;ENGENHEIROS AZUL;M;Engenheiros do Hawaii;;Engenheiros Azul;CAMISA CM M ENGENHEIROS AZUL;EQ;751;10,5;30;3;CMCMM00119;1;
Camisa ;com manga;ENGENHEIROS AZUL;G;Engenheiros do Hawaii;;Engenheiros Azul;CAMISA CM G ENGENHEIROS AZUL;EQ;751;10,5;24;7;CMCMG00116;1;
Camisa ;com manga;ENGENHEIROS AZUL;GG;Engenheiros do Hawaii;;Engenheiros Azul;CAMISA CM GG ENGENHEIROS AZUL;EQ;751;10,5;24;0;CMCMGG00066;1;
Camisa ;com manga;EVANESCENCE BANDA NOVA MASTER;M;Evanescence;;Evanescence Banda Nova Master;CAMISA CM M EVANESCENCE BANDA NOVA MASTER;MR;127;12,5;30;4;CMCMM00282;1;
Camisa ;com manga;EVANESCENCE BANDA NOVA MASTER;G;Evanescence;;Evanescence Banda Nova Master;CAMISA CM G EVANESCENCE BANDA NOVA MASTER;MR;127;12,5;30;7;CMCMG00283;1;
Camisa ;com manga;EVANESCENCE BANDA VELHA AZUL;M;Evanescence;;Evanescence Banda Velha Azul;CAMISA CM M EVANESCENCE BANDA VELHA AZUL;MR;44;12,5;30;0;CMCMM00264;1;
Camisa ;com manga;EVANESCENCE BANDA VELHA AZUL;G;Evanescence;;Evanescence Banda Velha Azul;CAMISA CM G EVANESCENCE BANDA VELHA AZUL;MR;44;12,5;30;4;CMCMG00265;1;
Camisa ;com manga;EVANESCENCE OLHOS AZUIS;P;Evanescence;;Evanescence Olhos Azuis;CAMISA CM P EVANESCENCE OLHOS AZUIS;EQ;431;10,5;30;8;CMCMP00085;1;
Camisa ;com manga;EVANESCENCE OLHOS AZUIS;M;Evanescence;;Evanescence Olhos Azuis;CAMISA CM M EVANESCENCE OLHOS AZUIS;EQ;431;10,5;30;10;CMCMM00084;1;
Camisa ;com manga;EXODUS BLACK ANGEL;M;Exodus;;Exodus Black Angel;CAMISA CM M EXODUS BLACK ANGEL;BLACK ANGE;1;12,5;30;7;CMCMM00242;1;
Camisa ;com manga;EXODUS BLACK ANGEL;G;Exodus;;Exodus Black Angel;CAMISA CM G EXODUS BLACK ANGEL;BLACK ANGE;1;12,5;30;8;CMCMG00244;1;
Camisa ;com manga;EXODUS BLACK ANGEL;GG;Exodus;;Exodus Black Angel;CAMISA CM GG EXODUS BLACK ANGEL;BLACK ANGE;1;12,4;30;5;CMCMGG00189;1;
Camisa ;com manga;FENDER;P;Guitarra;;Fender;CAMISA CM P FENDER;EQ;455;11;30;7;CMCMP00093;1;
Camisa ;com manga;FENDER;M;Guitarra;;Fender;CAMISA CM M FENDER;EQ;455;11;30;9;CMCMM00093;1;
Camisa ;com manga;FENDER;G;Guitarra;;Fender;CAMISA CM G FENDER;EQ;455;11;30;3;CMCMG00096;1;
Camisa ;com manga;FOO FIGHTERS;P;Foo Fighters;;Foo Fighters;CAMISA CM P FOO FIGHTERS;EQ;233;10,5;30;3;CMCMP00042;1;
Camisa ;com manga;FOO FIGHTERS;M;Foo Fighters;;Foo Fighters;CAMISA CM M FOO FIGHTERS;EQ;233;10,5;24;4;CMCMM00041;1;
Camisa ;com manga;FOO FIGHTERS;G;Foo Fighters;;Foo Fighters;CAMISA CM G FOO FIGHTERS;EQ;233;10,5;24;8;CMCMG00042;1;
Camisa ;com manga;GAME OF THRONES ANAO;P;Game of Thrones;;Game Of Thrones Anao;CAMISA CM P GAME OF THRONES ANAO;HCD;330;13,5;30;8;CMCMP00327;1;
Camisa ;com manga;GAME OF THRONES ANAO;M;Game of Thrones;;Game Of Thrones Anao;CAMISA CM M GAME OF THRONES ANAO;HCD;330;13,5;30;2;CMCMM00394;1;
Camisa ;com manga;GAME OF THRONES ANAO;G;Game of Thrones;;Game Of Thrones Anao;CAMISA CM G GAME OF THRONES ANAO;HCD;330;13,5;30;7;CMCMG00403;1;
Camisa ;com manga;GAME OF THRONES ANAO;GG;Game of Thrones;;Game Of Thrones Anao;CAMISA CM GG GAME OF THRONES ANAO;HCD;330;13,5;30;7;CMCMGG00318;1;
Camisa ;com manga;GAME OF THRONES DRAGAO;PP;Game of Thrones;;Game Of Thrones Dragao;CAMISA CM PP GAME OF THRONES DRAGAO;AN;2;11;30;0;CMCMPP00005;1;
Camisa ;com manga;GAME OF THRONES DRAGAO;P;Game of Thrones;;Game Of Thrones Dragao;CAMISA CM P GAME OF THRONES DRAGAO;AN;2;11;30;2;CMCMP00225;1;
Camisa ;com manga;GAME OF THRONES DRAGAO;M;Game of Thrones;;Game Of Thrones Dragao;CAMISA CM M GAME OF THRONES DRAGAO;AN;2;11;30;5;CMCMM00305;1;
Camisa ;com manga;GAME OF THRONES DRAGAO;G;Game of Thrones;;Game Of Thrones Dragao;CAMISA CM G GAME OF THRONES DRAGAO;AN;2;11;30;6;CMCMG00308;1;
Camisa ;com manga;GAME OF THRONES DRAGAO;GG;Game of Thrones;;Game Of Thrones Dragao;CAMISA CM GG GAME OF THRONES DRAGAO;AN;2;11;30;9;CMCMGG00228;1;
Camisa ;com manga;GAME OF THRONES LOBO;PP;Game of Thrones;;Game Of Thrones Lobo;CAMISA CM PP GAME OF THRONES LOBO;AN;4;11;30;0;CMCMPP00004;1;
Camisa ;com manga;GAME OF THRONES LOBO;P;Game of Thrones;;Game Of Thrones Lobo;CAMISA CM P GAME OF THRONES LOBO;AN;4;11;30;3;CMCMP00224;1;
Camisa ;com manga;GAME OF THRONES LOBO;M;Game of Thrones;;Game Of Thrones Lobo;CAMISA CM M GAME OF THRONES LOBO;AN;4;11;30;1;CMCMM00304;1;
Camisa ;com manga;GAME OF THRONES LOBO;G;Game of Thrones;;Game Of Thrones Lobo;CAMISA CM G GAME OF THRONES LOBO;AN;4;11;30;0;CMCMG00307;1;
Camisa ;com manga;GAME OF THRONES LOBO;GG;Game of Thrones;;Game Of Thrones Lobo;CAMISA CM GG GAME OF THRONES LOBO;AN;4;11;30;5;CMCMGG00227;1;
Camisa ;com manga;GAMES CHIFRE;P;Game of Thrones;;Games Chifre;CAMISA CM P GAMES CHIFRE;HCD;337;13;30;4;CMCMP00340;1;
Camisa ;com manga;GAMES CHIFRE;M;Game of Thrones;;Games Chifre;CAMISA CM M GAMES CHIFRE;HCD;337;13;30;1;CMCMM00409;1;
Camisa ;com manga;GAMES CHIFRE;G;Game of Thrones;;Games Chifre;CAMISA CM G GAMES CHIFRE;HCD;337;13;30;0;CMCMG00419;1;
Camisa ;com manga;GAMES CHIFRE;GG;Game of Thrones;;Games Chifre;CAMISA CM GG GAMES CHIFRE;HCD;337;13;30;1;CMCMGG00331;1;
Camisa ;com manga;GHOST AZUL;M;Ghost;;Ghost Azul;CAMISA CM M GHOST AZUL;PROFANUS;;12,5;30;4;CMCMM00245;1;
Camisa ;com manga;GHOST AZUL;G;Ghost;;Ghost Azul;CAMISA CM G GHOST AZUL;PROFANUS;;12,5;30;4;CMCMG00247;1;
Camisa ;com manga;GHOST AZUL;GG;Ghost;;Ghost Azul;CAMISA CM GG GHOST AZUL;PROFANUS;;12,5;30;5;CMCMGG00180;1;
Camisa ;com manga;GHOST MULHER;M;Ghost;;Ghost Mulher;CAMISA CM M GHOST MULHER;BLACK ANGE;44;12;30;0;CMCMM00342;1;
Camisa ;com manga;GHOST MULHER;G;Ghost;;Ghost Mulher;CAMISA CM G GHOST MULHER;BLACK ANGE;44;12;30;4;CMCMG00349;1;
Camisa ;com manga;GHOST MULHER;GG;Ghost;;Ghost Mulher;CAMISA CM GG GHOST MULHER;BLACK ANGE;44;12;30;5;CMCMGG00268;1;
Camisa ;com manga;GIBSON;P;Guitarra;;Gibson;CAMISA CM P GIBSON;EQ;454;11;30;10;CMCMP00092;1;
Camisa ;com manga;GIBSON;M;Guitarra;;Gibson;CAMISA CM M GIBSON;EQ;454;11;30;14;CMCMM00092;1;
Camisa ;com manga;GIBSON;G;Guitarra;;Gibson;CAMISA CM G GIBSON;EQ;454;11;30;6;CMCMG00089;1;
Camisa ;com manga;GOD OF WAR HCD;P;Games;;God Of War Hcd;CAMISA CM P GOD OF WAR HCD;HCD;291;12;30;0;CMCMP00292;1;
Camisa ;com manga;GOD OF WAR HCD;M;Games;;God Of War Hcd;CAMISA CM M GOD OF WAR HCD;HCD;291;12;30;9;CMCMM00353;1;
Camisa ;com manga;GOD OF WAR HCD;G;Games;;God Of War Hcd;CAMISA CM G GOD OF WAR HCD;HCD;291;12;30;19;CMCMG00361;1;
Camisa ;com manga;GOD OF WAR HCD;G;Games;;God Of War Hcd;CAMISA CM G GOD OF WAR HCD;HCD;291;12;30;0;CMCMG00360;1;
Camisa ;com manga;GOD OF WAR HCD;GG;Games;;God Of War Hcd;CAMISA CM GG GOD OF WAR HCD;HCD;291;12;30;12;CMCMGG00278;1;
Camisa ;com manga;GOD OF WAR HCD;XGG;Games;;God Of War Hcd;CAMISA CM XGG GOD OF WAR HCD;HCD;291;15;36;1;CMCMXGG00034;1;
Camisa ;com manga;GOD OF WAR JOAO;P;Games;;God Of War Joao;CAMISA CM P GOD OF WAR JOAO;JO;;11;30;0;CMCMP00232;1;
Camisa ;com manga;GOD OF WAR JOAO;M;Games;;God Of War Joao;CAMISA CM M GOD OF WAR JOAO;JO;;11;30;0;CMCMM00312;1;
Camisa ;com manga;GOD OF WAR JOAO;G;Games;;God Of War Joao;CAMISA CM G GOD OF WAR JOAO;JO;;11;30;-1;CMCMG00315;1;
Camisa ;com manga;GOD OF WAR JOAO;GG;Games;;God Of War Joao;CAMISA CM GG GOD OF WAR JOAO;JO;;11;30;7;CMCMGG00235;1;
Camisa ;com manga;GOD OF WAR MASTER;P;Games;;God Of War Master;CAMISA CM P GOD OF WAR MASTER;MR;1002;13;30;4;CMCMP00333;1;
Camisa ;com manga;GOD OF WAR MASTER;M;Games;;God Of War Master;CAMISA CM M GOD OF WAR MASTER;MR;1002;13;25;4;CMCMM00401;1;
Camisa ;com manga;GOD OF WAR MASTER;G;Games;;God Of War Master;CAMISA CM G GOD OF WAR MASTER;MR;1002;13;30;3;CMCMG00411;1;
Camisa ;com manga;GOD OF WAR MASTER;GG;Games;;God Of War Master;CAMISA CM GG GOD OF WAR MASTER;MR;1002;13;30;4;CMCMGG00325;1;
Camisa ;com manga;GOD OF WAR NOVA;P;Games;;God Of War Nova;CAMISA CM P GOD OF WAR NOVA;VIRUS;105;12,5;30;7;CMCMP00186;1;
Camisa ;com manga;GOD OF WAR NOVA;M;Games;;God Of War Nova;CAMISA CM M GOD OF WAR NOVA;VIRUS;105;12,5;30;4;CMCMM00187;1;
Camisa ;com manga;GOD OF WAR NOVA;G;Games;;God Of War Nova;CAMISA CM G GOD OF WAR NOVA;VIRUS;105;12,5;30;2;CMCMG00185;1;
Camisa ;com manga;GOD OF WAR NOVA;GG;Games;;God Of War Nova;CAMISA CM GG GOD OF WAR NOVA;VIRUS;105;12,5;30;12;CMCMGG00124;1;
Camisa ;com manga;GREEN DAY AMERICAN IDIOT;P;Green Day;;Green Day American Idiot;CAMISA CM P GREEN DAY AMERICAN IDIOT;EQ;429;11;30;9;CMCMP00083;1;
Camisa ;com manga;GREEN DAY AMERICAN IDIOT;M;Green Day;;Green Day American Idiot;CAMISA CM M GREEN DAY AMERICAN IDIOT;EQ;429;10,5;30;7;CMCMM00082;1;
Camisa ;com manga;GREEN DAY AMERICAN IDIOT;G;Green Day;;Green Day American Idiot;CAMISA CM G GREEN DAY AMERICAN IDIOT;EQ;429;10,5;30;7;CMCMG00081;1;
Camisa ;com manga;GUITARRA;P;Caveira;;Guitarra;CAMISA CM P GUITARRA;HCD;163;12,5;30;7;CMCMP00157;1;
Camisa ;com manga;GUITARRA;M;Caveira;;Guitarra;CAMISA CM M GUITARRA;HCD;163;12,5;30;6;CMCMM00152;1;
Camisa ;com manga;GUITARRA;G;Caveira;;Guitarra;CAMISA CM G GUITARRA;HCD;163;12,5;30;1;CMCMG00146;1;
Camisa ;com manga;GUITARRA;GG;Caveira;;Guitarra;CAMISA CM GG GUITARRA;HCD;163;12,5;30;6;CMCMGG00089;1;
Camisa ;com manga;GUITARRA;XGG;Caveira;;Guitarra;CAMISA CM XGG GUITARRA;HCD;163;15;36;0;CMCMXGG00035;1;
Camisa ;com manga;GUNS APPETITE;P;Guns n' Roses;;Guns Appetite;CAMISA CM P GUNS APPETITE;MR;180;12,5;30;2;CMCMP00220;1;
Camisa ;com manga;GUNS APPETITE;M;Guns n' Roses;;Guns Appetite;CAMISA CM M GUNS APPETITE;MR;180;12,5;30;5;CMCMM00294;1;
Camisa ;com manga;GUNS APPETITE;G;Guns n' Roses;;Guns Appetite;CAMISA CM G GUNS APPETITE;MR;180;12,5;30;4;CMCMG00296;1;
Camisa ;com manga;GUNS APPETITE;GG;Guns n' Roses;;Guns Appetite;CAMISA CM GG GUNS APPETITE;MR;180;12,5;30;2;CMCMGG00217;1;
Camisa ;com manga;GUNS AXL CANTANDO;P;Guns n' Roses;;Guns Axl Cantando;CAMISA CM P GUNS AXL CANTANDO;MR;63;11;30;4;CMCMP00241;1;
Camisa ;com manga;GUNS AXL CANTANDO;M;Guns n' Roses;;Guns Axl Cantando;CAMISA CM M GUNS AXL CANTANDO;MR;69;12,5;30;7;CMCMM00268;1;
Camisa ;com manga;GUNS AXL CANTANDO;G;Guns n' Roses;;Guns Axl Cantando;CAMISA CM G GUNS AXL CANTANDO;MR;69;12,5;30;2;CMCMG00269;1;
Camisa ;com manga;GUNS AXL CANTANDO;GG;Guns n' Roses;;Guns Axl Cantando;CAMISA CM GG GUNS AXL CANTANDO;MR;69;12,5;30;2;CMCMGG00200;1;
Camisa ;com manga;GUNS BANDA PROFANUS;M;Guns n' Roses;;Guns Banda Profanus;CAMISA CM M GUNS BANDA PROFANUS;PROFANUS;350;12,5;30;0;CMCMM00243;1;
Camisa ;com manga;GUNS BANDA PROFANUS;G;Guns n' Roses;;Guns Banda Profanus;CAMISA CM G GUNS BANDA PROFANUS;PROFANUS;350;12,5;30;0;CMCMG00245;1;
Camisa ;com manga;GUNS BANDA PROFANUS;GG;Guns n' Roses;;Guns Banda Profanus;CAMISA CM GG GUNS BANDA PROFANUS;PROFANUS;350;12,5;30;0;CMCMGG00178;1;
Camisa ;com manga;GUNS BANDA VIRUS;P;Guns n' Roses;;Guns Banda Virus;CAMISA CM P GUNS BANDA VIRUS;VIRUS;285;13;30;0;CMCMP00331;1;
Camisa ;com manga;GUNS BANDA VIRUS;M;Guns n' Roses;;Guns Banda Virus;CAMISA CM M GUNS BANDA VIRUS;VIRUS;285;13;30;0;CMCMM00399;1;
Camisa ;com manga;GUNS BANDA VIRUS;G;Guns n' Roses;;Guns Banda Virus;CAMISA CM G GUNS BANDA VIRUS;VIRUS;285;13;30;0;CMCMG00408;1;
Camisa ;com manga;GUNS BANDA VIRUS;GG;Guns n' Roses;;Guns Banda Virus;CAMISA CM GG GUNS BANDA VIRUS;VIRUS;285;13;30;0;CMCMGG00323;1;
Camisa ;com manga;GUNS CAVEIRA CARTOLA EQUINOX;P;Guns n' Roses;;Guns Caveira Cartola Equinox;CAMISA CM P GUNS CAVEIRA CARTOLA EQUINOX;EQ;336;11;30;8;CMCMP00056;1;
Camisa ;com manga;GUNS CAVEIRA CARTOLA EQUINOX;M;Guns n' Roses;;Guns Caveira Cartola Equinox;CAMISA CM M GUNS CAVEIRA CARTOLA EQUINOX;EQ;336;11;30;6;CMCMM00056;1;
Camisa ;com manga;GUNS CAVEIRA CARTOLA EQUINOX;G;Guns n' Roses;;Guns Caveira Cartola Equinox;CAMISA CM G GUNS CAVEIRA CARTOLA EQUINOX;EQ;336;10,5;30;8;CMCMG00056;1;
Camisa ;com manga;GUNS CAVEIRA CARTOLA MASTER;P;Guns n' Roses;;Guns Caveira Cartola Master;CAMISA CM P GUNS CAVEIRA CARTOLA MASTER;MR;185;11,5;30;4;CMCMP00245;1;
Camisa ;com manga;GUNS CAVEIRA CARTOLA MASTER;M;Guns n' Roses;;Guns Caveira Cartola Master;CAMISA CM M GUNS CAVEIRA CARTOLA MASTER;MR;185;12,5;30;5;CMCMM00297;1;
Camisa ;com manga;GUNS CAVEIRA CARTOLA MASTER;G;Guns n' Roses;;Guns Caveira Cartola Master;CAMISA CM G GUNS CAVEIRA CARTOLA MASTER;MR;185;12,5;30;0;CMCMG00299;1;
Camisa ;com manga;GUNS CAVEIRA CARTOLA MASTER;GG;Guns n' Roses;;Guns Caveira Cartola Master;CAMISA CM GG GUNS CAVEIRA CARTOLA MASTER;MR;185;12,5;30;11;CMCMGG00220;1;
Camisa ;com manga;GUNS DOURADA;P;Guns n' Roses;;Guns Dourada;CAMISA CM P GUNS DOURADA;EQ;253;10,5;30;0;CMCMP00047;1;
Camisa ;com manga;GUNS DOURADA;M;Guns n' Roses;;Guns Dourada;CAMISA CM M GUNS DOURADA;EQ;253;10,5;30;0;CMCMM00046;1;
Camisa ;com manga;GUNS DOURADA;G;Guns n' Roses;;Guns Dourada;CAMISA CM G GUNS DOURADA;EQ;253;10,5;30;0;CMCMG00047;1;
Camisa ;com manga;GUNS LOGO GRANDE JOAO;P;Guns n' Roses;;Guns Logo Grande Joao;CAMISA CM P GUNS LOGO GRANDE JOAO;JO;;11;30;0;CMCMP00238;1;
Camisa ;com manga;GUNS LOGO GRANDE JOAO;M;Guns n' Roses;;Guns Logo Grande Joao;CAMISA CM M GUNS LOGO GRANDE JOAO;JO;;11;30;1;CMCMM00318;1;
Camisa ;com manga;GUNS LOGO GRANDE JOAO;G;Guns n' Roses;;Guns Logo Grande Joao;CAMISA CM G GUNS LOGO GRANDE JOAO;JO;;11;30;-2;CMCMG00321;1;
Camisa ;com manga;GUNS LOGO GRANDE JOAO;GG;Guns n' Roses;;Guns Logo Grande Joao;CAMISA CM GG GUNS LOGO GRANDE JOAO;JO;;11;30;3;CMCMGG00241;1;
Camisa ;com manga;GUNS LOGO GRANDE MASTER;P;Guns n' Roses;;Guns Logo Grande Master;CAMISA CM P GUNS LOGO GRANDE MASTER;MR;195;12;30;3;CMCMP00309;1;
Camisa ;com manga;GUNS LOGO GRANDE MASTER;M;Guns n' Roses;;Guns Logo Grande Master;CAMISA CM M GUNS LOGO GRANDE MASTER;MR;195;12;30;3;CMCMM00373;1;
Camisa ;com manga;GUNS LOGO GRANDE MASTER;G;Guns n' Roses;;Guns Logo Grande Master;CAMISA CM G GUNS LOGO GRANDE MASTER;MR;195;12;30;6;CMCMG00381;1;
Camisa ;com manga;GUNS LOGO GRANDE MASTER;GG;Guns n' Roses;;Guns Logo Grande Master;CAMISA CM GG GUNS LOGO GRANDE MASTER;MR;195;12;30;5;CMCMGG00299;1;
Camisa ;com manga;GUNS NOME GRANDE;P;Guns n' Roses;;Guns Nome Grande;CAMISA CM P GUNS NOME GRANDE;JO;;11;30;0;CMCMP00239;1;
