Camisa ;Baby Look;ACDC ANGUS;G;AC/DC;;Acdc Angus;CAMISA BABY G ACDC ANGUS;MR;139;10;25;6;CMBLG00077;;
Camisa ;Baby Look;ACDC BACK IN BLACK;G;AC/DC;;Acdc Back In Black;CAMISA BABY G ACDC BACK IN BLACK;AN;10;10;25;0;CMBLG00014;1;
Camisa ;Baby Look;ACDC BACK IN BLACK;GG;AC/DC;;Acdc Back In Black;CAMISA BABY GG ACDC BACK IN BLACK;AN;10;10;25;26;CMBLGG00004;1;
Camisa ;Baby Look;ACDC BLACK ICE;G;AC/DC;;Acdc Black Ice;CAMISA BABY G ACDC BLACK ICE;VIRUS;13;10;25;4;CMBLG00005;;
Camisa ;Baby Look;ACDC CANHAO BRANCA;G;AC/DC;;Acdc Canhao Branca;CAMISA BABY G ACDC CANHAO BRANCA;VIRUS;15;10;25;12;CMBLG00047;;
Camisa ;Baby Look;ARCTIC MONKEYS;G;Artic Monkeys;;Arctic Monkeys;CAMISA BABY G ARCTIC MONKEYS;EQ;160;10;25;0;CMBLG00035;;
Camisa ;Baby Look;ASKING;G;Asking Alexandria;;Asking;CAMISA BABY G ASKING;VIRUS;75;10;25;12;CMBLG00055;;
Camisa ;Baby Look;ASKING MULHER;G;Asking Alexandria;;Asking Mulher;CAMISA BABY G ASKING MULHER;VIRUS;260;10;25;6;CMBLG00084;;
Camisa ;Baby Look;AVENGED NIGHTMARE;G;Avenged Sevenfold;;Avenged Nightmare;CAMISA BABY G AVENGED NIGHTMARE;VIRUS;39;10;25;4;CMBLG00046;;
Camisa ;Baby Look;AVENGED NIGHTMARE MASTER;G;Avenged Sevenfold;;Avenged Nightmare Master;CAMISA BABY G AVENGED NIGHTMARE MASTER;MR;118;10;25;0;CMBLG00063;;
Camisa ;Baby Look;AVENGED TRADICIONAL;G;Avenged Sevenfold;;Avenged Tradicional;CAMISA BABY G AVENGED TRADICIONAL;EQ;292;10;25;4;CMBLG00044;1;
Camisa ;Baby Look;AVENGED TRADICIONAL;GG;Avenged Sevenfold;;Avenged Tradicional;CAMISA BABY GG AVENGED TRADICIONAL;JO;;10;25;0;CMBLGG00013;1;
Camisa ;Baby Look;BABY LOOK;G;;;Baby Look;CAMISA BABY LOOK;AN;;10;25;0;CMBLG00085;;
Camisa ;Baby Look;BAZINGA;G;The Big Bang Theory;;Bazinga;CAMISA BABY G BAZINGA;AN;;10;25;7;CMBLG00020;1;
Camisa ;Baby Look;BAZINGA;GG;The Big Bang Theory;;Bazinga;CAMISA BABY GG BAZINGA;AN;;10;25;9;CMBLGG00008;1;
Camisa ;Baby Look;BEATLES ATRAVESSANDO ROAD;G;Beatles;;Beatles Atravessando Road;CAMISA BABY G BEATLES ATRAVESSANDO ROAD;MR;134;10;25;8;CMBLG00068;;
Camisa ;Baby Look;BEATLES BANDA BRANCA;G;Beatles;;Beatles Banda Branca;CAMISA BABY G BEATLES BANDA BRANCA;VIRUS;93;10;25;8;CMBLG00007;;
Camisa ;Baby Look;BEATLES SGT PEPPERS;G;Beatles;;Beatles Sgt Peppers;CAMISA BABY G BEATLES SGT PEPPERS;JO;;10;25;9;CMBLG00042;1;
Camisa ;Baby Look;BEATLES SGT PEPPERS;GG;Beatles;;Beatles Sgt Peppers;CAMISA BABY GG BEATLES SGT PEPPERS;JO;;10;25;-2;CMBLGG00011;1;
Camisa ;Baby Look;BEATLES YELLOW;G;Beatles;;Beatles Yellow;CAMISA BABY G BEATLES YELLOW;AN;3;10;25;0;CMBLG00018;1;
Camisa ;Baby Look;BEATLES YELLOW;GG;Beatles;;Beatles Yellow;CAMISA BABY GG BEATLES YELLOW;AN;3;10;25;7;CMBLGG00007;1;
Camisa ;Baby Look;BIGODE;G;;;Bigode;CAMISA BABY G BIGODE;EQ;337;10;25;1;CMBLG00034;;
Camisa ;Baby Look;BLACK SABBATH HEAVEN AND HELL;G;Black Sabbath;;Black Sabbath Heaven And Hell;CAMISA BABY G BLACK SABBATH HEAVEN AND HELL;PROFANUS;341;10;25;1;CMBLG00057;;
Camisa ;Baby Look;BLACK SABBATH US TOUR;G;Black Sabbath;;Black Sabbath Us Tour;CAMISA BABY G BLACK SABBATH US TOUR;BLACK ANGE;78;10;25;6;CMBLG00056;;
Camisa ;Baby Look;BLACK SABBATH VOL 4;G;Black Sabbath;;Black Sabbath Vol 4;CAMISA BABY G BLACK SABBATH VOL 4;VIRUS;64;10;25;17;CMBLG00052;;
Camisa ;Baby Look;BON JOVI LOGO DOURADO;G;Bon Jovi;;Bon Jovi Logo Dourado;CAMISA BABY G BON JOVI LOGO DOURADO;EQ;306;10;25;10;CMBLG00022;;
Camisa ;Baby Look;CAPACETE STORMTROOPER;G;Star Wars;;Capacete Stormtrooper;CAMISA BABY G CAPACETE STORMTROOPER;EQ;117;10;25;2;CMBLG00023;;
Camisa ;Baby Look;CAPACETE STORMTROOPER BRANCA;G;Star Wars;;Capacete Stormtrooper Branca;CAMISA BABY G CAPACETE STORMTROOPER BRANCA;EQ;117;12,5;31,25;9;CMBLG00086;;
Camisa ;Baby Look;CAVEIRA MEXICANA COLORIDA BRANCA;G;Caveira;;Caveira Mexicana Colorida Branca;CAMISA BABY G CAVEIRA MEXICANA COLORIDA BRANCA;HCD;286B;10;25;7;CMBLG00079;;
Camisa ;Baby Look;CAVEIRA MEXICANA COLORIDA PRETA;G;Caveira;;Caveira Mexicana Colorida Preta;CAMISA BABY G CAVEIRA MEXICANA COLORIDA PRETA;HCD;286;10;25;0;CMBLG00080;;
Camisa ;Baby Look;CAVEIRA MEXICANA ROSAS;G;Caveira;;Caveira Mexicana Rosas;CAMISA BABY G CAVEIRA MEXICANA ROSAS;HCD;307;10;25;0;CMBLG00082;;
Camisa ;Baby Look;CORINGA;G;Quadrinhos;;Coringa;CAMISA BABY G CORINGA;MR;144;10;25;0;CMBLG00071;;
Camisa ;Baby Look;DARK SIDE VADER;G;Pink Floyd;;Dark Side Vader;CAMISA BABY G DARK SIDE VADER;EQ;325;10;25;6;CMBLG00033;;
Camisa ;Baby Look;DAVID CAVEIRA;G;David Bowie;;David Caveira;CAMISA BABY G DAVID CAVEIRA;HCD;270;10;25;10;CMBLG00081;;
Camisa ;Baby Look;DAVID ROSTO;G;Caveira;;David Rosto;CAMISA BABY G DAVID ROSTO;HCD;316;10;25;2;CMBLG00083;;
Camisa ;Baby Look;EVANESCENCE BANDA ANTIGA;G;Evanescence;;Evanescence Banda Antiga;CAMISA BABY G EVANESCENCE BANDA ANTIGA;MR;502;10;25;0;CMBLG00061;;
Camisa ;Baby Look;EVANESCENCE BANDA NOVA MASTER;G;Evanescence;;Evanescence Banda Nova Master;CAMISA BABY G EVANESCENCE BANDA NOVA MASTER;MR;127;10;25;0;CMBLG00066;;
Camisa ;Baby Look;GREEN DAY AMERICAN IDIOT;G;Green Day;;Green Day American Idiot;CAMISA BABY G GREEN DAY AMERICAN IDIOT;EQ;96;10;25;25;CMBLG00037;;
Camisa ;Baby Look;GUNS AXL CANTANDO;G;Guns n' Roses;;Guns Axl Cantando;CAMISA BABY G GUNS AXL CANTANDO;MR;520;10;25;1;CMBLG00060;;
Camisa ;Baby Look;GUNS CARTOLA EQUINOX;G;Guns n' Roses;;Guns Cartola Equinox;CAMISA BABY G GUNS CARTOLA EQUINOX;EQ;17;10;25;8;CMBLG00030;;
Camisa ;Baby Look;GUNS CAVEIRA MASTER;G;Guns n' Roses;;Guns Caveira Master;CAMISA BABY G GUNS CAVEIRA MASTER;MR;185;10;25;11;CMBLG00075;;
Camisa ;Baby Look;GUNS LOGO GRANDE JOAO;G;Guns n' Roses;;Guns Logo Grande Joao;CAMISA BABY G GUNS LOGO GRANDE JOAO;JO;;10;25;0;CMBLG00043;1;
Camisa ;Baby Look;GUNS LOGO GRANDE JOAO;GG;Guns n' Roses;;Guns Logo Grande Joao;CAMISA BABY GG GUNS LOGO GRANDE JOAO;JO;;10;25;1;CMBLGG00012;1;
Camisa ;Baby Look;GUNS LOGO GRANDE MASTER;G;Guns n' Roses;;Guns Logo Grande Master;CAMISA BABY G GUNS LOGO GRANDE MASTER;MR;195;10;25;0;CMBLG00073;;
Camisa ;Baby Look;IRON FEAR;G;Iron Maiden;;Iron Fear;CAMISA BABY G IRON FEAR;VIRUS;12;10;25;11;CMBLG00010;;
Camisa ;Baby Look;IRON KILLERS VIRUS;G;Iron Maiden;;Iron Killers Virus;CAMISA BABY G IRON KILLERS VIRUS;VIRUS;74;10;25;10;CMBLG00002;;
Camisa ;Baby Look;IRON NUMBER;G;Iron Maiden;;Iron Number;CAMISA BABY G IRON NUMBER;VIRUS;47;10;25;25;CMBLG00001;;
Camisa ;Baby Look;IRON TROOPER A PE;G;Iron Maiden;;Iron Trooper A Pe;CAMISA BABY G IRON TROOPER A PE;VIRUS;189;10;25;0;CMBLG00078;1;
Camisa ;Baby Look;IRON TROOPER A PE;GG;Iron Maiden;;Iron Trooper A Pe;CAMISA BABY GG IRON TROOPER A PE;JO;;1;25;3;CMBLGG00014;1;
Camisa ;Baby Look;IRON TROOPER CAVALO;G;Iron Maiden;;Iron Trooper Cavalo;CAMISA BABY G IRON TROOPER CAVALO;MR;126;10;25;3;CMBLG00065;;
Camisa ;Baby Look;JACK DANIELS;G;Jack Daniels;;Jack Daniels;CAMISA BABY G JACK DANIELS;AN;8;10;25;22;CMBLG00017;1;
Camisa ;Baby Look;JACK DANIELS;GG;Jack Daniels;;Jack Daniels;CAMISA BABY GG JACK DANIELS;AN;8;10;25;5;CMBLGG00010;1;
Camisa ;Baby Look;JOY DIVISION;G;Joy Division;;Joy Division;CAMISA BABY G JOY DIVISION;EQ;300;10;25;16;CMBLG00039;;
Camisa ;Baby Look;JUDAS STEEL;G;Judas;;Judas Steel;CAMISA BABY G JUDAS STEEL;PROFANUS;153;10;25;2;CMBLG00059;;
Camisa ;Baby Look;KISS ROCK AND ROLL;G;Kiss;;Kiss Rock And Roll;CAMISA BABY G KISS ROCK AND ROLL;VIRUS;77;10;25;6;CMBLG00049;;
Camisa ;Baby Look;LARANJA MECANICA;G;Laranja Mecanica;;Laranja Mecanica;CAMISA BABY G LARANJA MECANICA;AN;5;10;25;14;CMBLG00013;1;
Camisa ;Baby Look;LARANJA MECANICA;GG;Laranja Mecanica;;Laranja Mecanica;CAMISA BABY GG LARANJA MECANICA;AN;5;10;25;0;CMBLGG00003;1;
Camisa ;Baby Look;LED ZEPPELIN ANJO COLORIDO;G;Led Zeppelin;;Led Zeppelin Anjo Colorido;CAMISA BABY G LED ZEPPELIN ANJO COLORIDO;VIRUS;24;10;25;19;CMBLG00048;;
Camisa ;Baby Look;LED ZEPPELIN ANJO DOURADO;G;Led Zeppelin;;Led Zeppelin Anjo Dourado;CAMISA BABY G LED ZEPPELIN ANJO DOURADO;EQ;44;10;25;8;CMBLG00027;;
Camisa ;Baby Look;LED ZEPPELIN EREMITA;G;Led Zeppelin;;Led Zeppelin Eremita;CAMISA BABY G LED ZEPPELIN EREMITA;EQ;100;10;25;16;CMBLG00025;;
Camisa ;Baby Look;LED ZEPPELIN MOTHERSHIP BRANCA;G;Led Zeppelin;;Led Zeppelin Mothership Branca;CAMISA BABY G LED ZEPPELIN MOTHERSHIP BRANCA;EQ;302;10;25;4;CMBLG00026;;
Camisa ;Baby Look;LEGIAO URBANA LOGO DOURADA;G;Legiao Urbana;;Legiao Urbana Logo Dourada;CAMISA BABY G LEGIAO URBANA LOGO DOURADA;EQ;27;10;25;4;CMBLG00029;;
Camisa ;Baby Look;LINKIN PARK METEORA;G;Linkin Park;;Linkin Park Meteora;CAMISA BABY G LINKIN PARK METEORA;EQ;BABY385;10;25;9;CMBLG00041;;
Camisa ;Baby Look;LINKIN PARK ROAD ESCRITO BRANCO;G;Linkin Park;;Linkin Park Road Escrito Branco;CAMISA BABY G LINKIN PARK ROAD ESCRITO BRANCO;EQ;326;10;25;6;CMBLG00031;;
Camisa ;Baby Look;MEGADETH BOMBA;G;Megadeth;;Megadeth Bomba;CAMISA BABY G MEGADETH BOMBA;VIRUS;91;10;25;9;CMBLG00054;;
Camisa ;Baby Look;MEGADETH RUST;G;Megadeth;;Megadeth Rust;CAMISA BABY G MEGADETH RUST;MR;192;10;25;11;CMBLG00072;;
Camisa ;Baby Look;METALLICA JUSTICE;G;Metallica;;Metallica Justice;CAMISA BABY G METALLICA JUSTICE;VIRUS;113;10;25;4;CMBLG00008;;
Camisa ;Baby Look;METALLICA KILL;G;Metallica;;Metallica Kill;CAMISA BABY G METALLICA KILL;VIRUS;63;10;25;7;CMBLG00051;;
Camisa ;Baby Look;METALLICA MAGNETIC BRANCA;G;Metallica;;Metallica Magnetic Branca;CAMISA BABY G METALLICA MAGNETIC BRANCA;MR;179;10;25;15;CMBLG00076;;
Camisa ;Baby Look;METALLICA MASTER ALBUM;G;Metallica;;Metallica Master Album;CAMISA BABY G METALLICA MASTER ALBUM;VIRUS;111;10;25;0;CMBLG00058;;
Camisa ;Baby Look;METALLICA RIDE;G;Metallica;;Metallica Ride;CAMISA BABY G METALLICA RIDE;VIRUS;6;10;25;0;CMBLG00045;;
Camisa ;Baby Look;METALLICA ST ANGER PUNHO;G;Metallica;;Metallica St Anger Punho;CAMISA BABY G METALLICA ST ANGER PUNHO;VIRUS;67;10;25;7;CMBLG00053;;
Camisa ;Baby Look;MOTORHEAD TRADICIONAL;G;Motorhead;;Motorhead Tradicional;CAMISA BABY G MOTORHEAD TRADICIONAL;EQ;97;10;25;5;CMBLG00028;;
Camisa ;Baby Look;NIRVANA NEVERMIND;G;Nirvana;;Nirvana Nevermind;CAMISA BABY G NIRVANA NEVERMIND;MR;137;10;25;0;CMBLG00070;;
Camisa ;Baby Look;NIRVANA SMILE;G;Nirvana;;Nirvana Smile;CAMISA BABY G NIRVANA SMILE;AN;6;10;25;6;CMBLG00011;1;
Camisa ;Baby Look;NIRVANA SMILE;GG;Nirvana;;Nirvana Smile;CAMISA BABY GG NIRVANA SMILE;AN;6;10;25;1;CMBLGG00001;1;
Camisa ;Baby Look;PANTERA DOURADA OFFICIAL;G;Pantera;;Pantera Dourada Official;CAMISA BABY G PANTERA DOURADA OFFICIAL;EQ;BABY766;10;25;19;CMBLG00040;;
Camisa ;Baby Look;PASSARO VERMELHO;G;Angry Birds;;Passaro Vermelho;CAMISA BABY G PASSARO VERMELHO;AN;;10;25;10;CMBLG00019;1;
Camisa ;Baby Look;PASSARO VERMELHO;GG;Angry Birds;;Passaro Vermelho;CAMISA BABY GG PASSARO VERMELHO;AN;;10;25;13;CMBLGG00009;1;
Camisa ;Baby Look;PEARL JAM BONEQUINHO;G;Pearl Jam;;Pearl Jam Bonequinho;CAMISA BABY G PEARL JAM BONEQUINHO;EQ;34;10;25;10;CMBLG00032;;
Camisa ;Baby Look;PINK FLOYD WALL PRETA;G;Pink Floyd;;Pink Floyd Wall Preta;CAMISA BABY G PINK FLOYD WALL PRETA;MR;135;10;25;10;CMBLG00069;;
Camisa ;Baby Look;PIRATAS DO CARIBE;G;Filmes;;Piratas Do Caribe;CAMISA BABY G PIRATAS DO CARIBE;MR;200;10;25;13;CMBLG00074;;
Camisa ;Baby Look;QUEEN DOURADA;G;Queen;;Queen Dourada;CAMISA BABY G QUEEN DOURADA;EQ;328;10;25;4;CMBLG00024;;
Camisa ;Baby Look;RAMONES BANDA BRANCA;G;Ramones;;Ramones Banda Branca;CAMISA BABY G RAMONES BANDA BRANCA;VIRUS;115;10;25;4;CMBLG00003;;
Camisa ;Baby Look;RAMONES TRADICIONAL PRETA;G;Ramones;;Ramones Tradicional Preta;CAMISA BABY G RAMONES TRADICIONAL PRETA;AN;7;10;25;11;CMBLG00016;1;
Camisa ;Baby Look;RAMONES TRADICIONAL PRETA;GG;Ramones;;Ramones Tradicional Preta;CAMISA BABY GG RAMONES TRADICIONAL PRETA;AN;7;10;25;7;CMBLGG00006;1;
Camisa ;Baby Look;RED HOT BRANCA;G;Red Hot Chili Peppers;;Red Hot Branca;CAMISA BABY G RED HOT BRANCA;VIRUS;94;10;25;6;CMBLG00006;;
Camisa ;Baby Look;RED HOT PRETA;G;Red Hot Chili Peppers;;Red Hot Preta;CAMISA BABY G RED HOT PRETA;AN;1;10;25;0;CMBLG00015;1;
Camisa ;Baby Look;RED HOT PRETA;GG;Red Hot Chili Peppers;;Red Hot Preta;CAMISA BABY GG RED HOT PRETA;AN;1;10;25;13;CMBLGG00005;1;
Camisa ;Baby Look;SEX PISTOLS AMARELA;G;Sex Pistols;;Sex Pistols Amarela;CAMISA BABY G SEX PISTOLS AMARELA;EQ;219;10;25;7;CMBLG00021;;
Camisa ;Baby Look;SLIPKNOT BANDA NOVA MASTER;G;Slipknot;;Slipknot Banda Nova Master;CAMISA BABY G SLIPKNOT BANDA NOVA MASTER;MR;122;10;25;0;CMBLG00064;;
Camisa ;Baby Look;SLIPKNOT BANDA VELHA VIRUS;G;Slipknot;;Slipknot Banda Velha Virus;CAMISA BABY G SLIPKNOT BANDA VELHA VIRUS;VIRUS;81;10;25;3;CMBLG00004;;
Camisa ;Baby Look;STONES LINGUA PRETA;G;Rolling Stones;;Stones Lingua Preta;CAMISA BABY G STONES LINGUA PRETA;AN;9;10;25;3;CMBLG00012;1;
Camisa ;Baby Look;STONES LINGUA PRETA;GG;Rolling Stones;;Stones Lingua Preta;CAMISA BABY GG STONES LINGUA PRETA;AN;9;10;25;14;CMBLGG00002;1;
Camisa ;Baby Look;STROKES PRETA;G;The Strokes;;Strokes Preta;CAMISA BABY G STROKES PRETA;EQ;161;10;25;8;CMBLG00036;;
Camisa ;Baby Look;SYSTEM BANDA NOVA VIRUS;G;System Of A Down;;System Banda Nova Virus;CAMISA BABY G SYSTEM BANDA NOVA VIRUS;VIRUS;97;10;25;7;CMBLG00009;;
Camisa ;Baby Look;SYSTEM BONEQUINHOS;G;System Of A Down;;System Bonequinhos;CAMISA BABY G SYSTEM BONEQUINHOS;MR;78;10;25;0;CMBLG00062;;
Camisa ;Baby Look;SYSTEM MEZMERIZE BANDA;G;System Of A Down;;System Mezmerize Banda;CAMISA BABY G SYSTEM MEZMERIZE BANDA;MR;133;10;25;9;CMBLG00067;;
Camisa ;Baby Look;VAN HALEN LOGO DOURADO;G;Van Halen;;Van Halen Logo Dourado;CAMISA BABY G VAN HALEN LOGO DOURADO;EQ;254;10;25;12;CMBLG00038;;
Camisa ;Body;ACDC LOGO CINZA;GG;AC/DC;;Acdc Logo Cinza;CAMISA BODY GG ACDC LOGO CINZA;EQ;7;12,5;25;0;CMBYGG00002;;
Camisa ;Body;BEATLES LOGO CINZA;GG;Beatles;;Beatles Logo Cinza;CAMISA BODY GG BEATLES LOGO CINZA;EQ;37;12,5;25;4;CMBYGG00012;;
Camisa ;Body;CAVEIRA ROSA;GG;Caveira;;Caveira Rosa;CAMISA BODY GG CAVEIRA ROSA;EQ;47;12,5;25;0;CMBYGG00011;;
Camisa ;Body;CAVEIRINHAS PRETA;GG;Caveira;;Caveirinhas Preta;CAMISA BODY GG CAVEIRINHAS PRETA;EQ;15BINF;12,5;25;0;CMBYGG00001;;
Camisa ;Body;GUNS CAVEIRA;GG;Guns n' Roses;;Guns Caveira;CAMISA BODY GG GUNS CAVEIRA;EQ;18;12,5;25;2;CMBYGG00003;;
Camisa ;Body;LED ZEPPELIN CINZA;GG;Led Zeppelin;;Led Zeppelin Cinza;CAMISA BODY GG LED ZEPPELIN CINZA;EQ;33;12,5;25;5;CMBYGG00007;;
Camisa ;Body;LED ZEPPELIN EREMITA;GG;Led Zeppelin;;Led Zeppelin Eremita;CAMISA BODY GG LED ZEPPELIN EREMITA;EQ;41;12,5;25;0;CMBYGG00009;;
Camisa ;Body;LEGIAO URBANA LOGO DOURADA;GG;Legiao Urbana;;Legiao Urbana Logo Dourada;CAMISA BODY GG LEGIAO URBANA LOGO DOURADA;EQ;25;12,5;25;0;CMBYGG00004;;
Camisa ;Body;PEARL JAM CINZA;GG;Pearl Jam;;Pearl Jam Cinza;CAMISA BODY GG PEARL JAM CINZA;EQ;28;12,5;25;0;CMBYGG00005;;
Camisa ;Body;RAMONES TRADICIONAL CINZA;GG;Ramones;;Ramones Tradicional Cinza;CAMISA BODY GG RAMONES TRADICIONAL CINZA;EQ;29;12,5;25;0;CMBYGG00006;;
Camisa ;Body;STAR WARS CAPACETE;GG;Star Wars;;Star Wars Capacete;CAMISA BODY GG STAR WARS CAPACETE;EQ;43;12,5;25;1;CMBYGG00010;;
Camisa ;Body;STONES LINGUA BRANCA;GG;Rolling Stones;;Stones Lingua Branca;CAMISA BODY GG STONES LINGUA BRANCA;EQ;35;12,5;25;0;CMBYGG00008;;
Camisa ;com manga;ACDC ANGUS;P;AC/DC;;Acdc Angus;CAMISA CM P ACDC ANGUS;MR;139;12,5;30;6;CMCMP00216;1;
Camisa ;com manga;ACDC ANGUS;M;AC/DC;;Acdc Angus;CAMISA CM M ACDC ANGUS;MR;139;12,5;30;14;CMCMM00288;1;
Camisa ;com manga;ACDC ANGUS;G;AC/DC;;Acdc Angus;CAMISA CM G ACDC ANGUS;MR;139;12,5;30;5;CMCMG00290;1;
Camisa ;com manga;ACDC ANGUS;GG;AC/DC;;Acdc Angus;CAMISA CM GG ACDC ANGUS;MR;139;12,5;30;13;CMCMGG00212;1;
Camisa ;com manga;ACDC BACK IN BLACK;PP;AC/DC;;Acdc Back In Black;CAMISA CM PP ACDC BACK IN BLACK;AN;10;12;30;9;CMCMPP00008;1;
Camisa ;com manga;ACDC BACK IN BLACK;P;AC/DC;;Acdc Back In Black;CAMISA CM P ACDC BACK IN BLACK;AN;10;11;30;15;CMCMP00228;1;
Camisa ;com manga;ACDC BACK IN BLACK;M;AC/DC;;Acdc Back In Black;CAMISA CM M ACDC BACK IN BLACK;AN;10;11;30;11;CMCMM00308;1;
Camisa ;com manga;ACDC BACK IN BLACK;G;AC/DC;;Acdc Back In Black;CAMISA CM G ACDC BACK IN BLACK;AN;10;11;30;14;CMCMG00311;1;
Camisa ;com manga;ACDC BACK IN BLACK;GG;AC/DC;;Acdc Back In Black;CAMISA CM GG ACDC BACK IN BLACK;AN;10;11;30;14;CMCMGG00231;1;
Camisa ;com manga;ACDC BLACK ICE;P;AC/DC;;Acdc Black Ice;CAMISA CM P ACDC BLACK ICE;VIRUS;13;12,5;30;4;CMCMP00177;1;
Camisa ;com manga;ACDC BLACK ICE;M;AC/DC;;Acdc Black Ice;CAMISA CM M ACDC BLACK ICE;VIRUS;13;12,5;30;1;CMCMM00173;1;
Camisa ;com manga;ACDC BLACK ICE;G;AC/DC;;Acdc Black Ice;CAMISA CM G ACDC BLACK ICE;VIRUS;13;12,5;30;11;CMCMG00171;1;
Camisa ;com manga;ACDC BLACK ICE;GG;AC/DC;;Acdc Black Ice;CAMISA CM GG ACDC BLACK ICE;VIRUS;13;12,5;30;4;CMCMGG00135;1;
Camisa ;com manga;ACDC BLACK ICE;XGG;AC/DC;;Acdc Black Ice;CAMISA CM XGG ACDC BLACK ICE;VIRUS;13;12;30;5;CMCMXGG00014;1;
Camisa ;com manga;ACDC CANHAO BRANCA;P;AC/DC;;Acdc Canhao Branca;CAMISA CM P ACDC CANHAO BRANCA;VIRUS;15;12,5;30;3;CMCMP00179;1;
Camisa ;com manga;ACDC CANHAO BRANCA;M;AC/DC;;Acdc Canhao Branca;CAMISA CM M ACDC CANHAO BRANCA;VIRUS;15;12,5;30;14;CMCMM00175;1;
Camisa ;com manga;ACDC CANHAO BRANCA;G;AC/DC;;Acdc Canhao Branca;CAMISA CM G ACDC CANHAO BRANCA;VIRUS;15;12,5;30;3;CMCMG00173;1;
Camisa ;com manga;ACDC CANHAO BRANCA;GG;AC/DC;;Acdc Canhao Branca;CAMISA CM GG ACDC CANHAO BRANCA;VIRUS;15;12,5;30;21;CMCMGG00114;1;
Camisa ;com manga;ACDC HELLS BELLS;P;AC/DC;;Acdc Hells Bells;CAMISA CM P ACDC HELLS BELLS;PROFANUS;296;12,5;30;14;CMCMP00193;1;
Camisa ;com manga;ACDC HELLS BELLS;M;AC/DC;;Acdc Hells Bells;CAMISA CM M ACDC HELLS BELLS;PROFANUS;296;12,5;30;11;CMCMM00224;1;
Camisa ;com manga;ACDC HELLS BELLS;G;AC/DC;;Acdc Hells Bells;CAMISA CM G ACDC HELLS BELLS;PROFANUS;296;12,5;30;9;CMCMG00225;1;
Camisa ;com manga;ACDC HELLS BELLS;GG;AC/DC;;Acdc Hells Bells;CAMISA CM GG ACDC HELLS BELLS;PROFANUS;296;12,5;30;20;CMCMGG00159;1;
Camisa ;com manga;ACDC HELLS BELLS;XGG;AC/DC;;Acdc Hells Bells;CAMISA CM XGG ACDC HELLS BELLS;PROFANUS;296;13;30;6;CMCMXGG00006;1;
Camisa ;com manga;ACDC HIGHWAY;P;AC/DC;;Acdc Highway;CAMISA CM P ACDC HIGHWAY;VIRUS;186;12,5;30;6;CMCMP00197;1;
Camisa ;com manga;ACDC HIGHWAY;M;AC/DC;;Acdc Highway;CAMISA CM M ACDC HIGHWAY;VIRUS;186;12,5;30;4;CMCMM00240;1;
Camisa ;com manga;ACDC HIGHWAY;G;AC/DC;;Acdc Highway;CAMISA CM G ACDC HIGHWAY;VIRUS;186;12,5;30;3;CMCMG00241;1;
Camisa ;com manga;ACDC HIGHWAY;G;AC/DC;;Acdc Highway;CAMISA CM G ACDC HIGHWAY;PROFANUS;353;12,5;30;-3;CMCMG00242;1;
Camisa ;com manga;ACDC HIGHWAY;GG;AC/DC;;Acdc Highway;CAMISA CM GG ACDC HIGHWAY;VIRUS;186;12,5;30;7;CMCMGG00175;1;
Camisa ;com manga;ALICE IN CHAINS CACHORRO;M;Alice in Chains;;Alice In Chains Cachorro;CAMISA CM M ALICE IN CHAINS CACHORRO;PROFANUS;305;12,5;30;7;CMCMM00226;1;
Camisa ;com manga;ALICE IN CHAINS CACHORRO;G;Alice in Chains;;Alice In Chains Cachorro;CAMISA CM G ALICE IN CHAINS CACHORRO;PROFANUS;305;12,5;30;6;CMCMG00227;1;
Camisa ;com manga;ALICE IN CHAINS CACHORRO;GG;Alice in Chains;;Alice In Chains Cachorro;CAMISA CM GG ALICE IN CHAINS CACHORRO;PROFANUS;305;12,5;30;13;CMCMGG00161;1;
Camisa ;com manga;ALICE IN CHAINS CAVEIRA COLORIDA;P;Alice in Chains;;Alice In Chains Caveira Colorida;CAMISA CM P ALICE IN CHAINS CAVEIRA COLORIDA;EQ;768;11;30;11;CMCMP00130;1;
Camisa ;com manga;ALICE IN CHAINS CAVEIRA COLORIDA;M;Alice in Chains;;Alice In Chains Caveira Colorida;CAMISA CM M ALICE IN CHAINS CAVEIRA COLORIDA;EQ;768;11;30;6;CMCMM00128;1;
Camisa ;com manga;ALICE IN CHAINS CAVEIRA COLORIDA;G;Alice in Chains;;Alice In Chains Caveira Colorida;CAMISA CM G ALICE IN CHAINS CAVEIRA COLORIDA;EQ;768;11;30;7;CMCMG00125;1;
Camisa ;com manga;ALICE IN CHAINS CAVEIRA COLORIDA;GG;Alice in Chains;;Alice In Chains Caveira Colorida;CAMISA CM GG ALICE IN CHAINS CAVEIRA COLORIDA;EQ;768;10,5;30;0;CMCMGG00072;1;
Camisa ;com manga;ALICE IN CHAINS SOL;P;Alice in Chains;;Alice In Chains Sol;CAMISA CM P ALICE IN CHAINS SOL;EQ;584;10,5;24;4;CMCMP00100;1;
Camisa ;com manga;ALICE IN CHAINS SOL;M;Alice in Chains;;Alice In Chains Sol;CAMISA CM M ALICE IN CHAINS SOL;EQ;584;11;30;7;CMCMM00099;1;
Camisa ;com manga;ALICE IN CHAINS SOL;G;Alice in Chains;;Alice In Chains Sol;CAMISA CM G ALICE IN CHAINS SOL;EQ;584;11;30;4;CMCMG00097;1;
Camisa ;com manga;AMON AMARTH CINZA;M;Amon Amarth;;Amon Amarth Cinza;CAMISA CM M AMON AMARTH CINZA;PROFANUS;274;12,5;30;2;CMCMM00218;1;
Camisa ;com manga;AMON AMARTH CINZA;G;Amon Amarth;;Amon Amarth Cinza;CAMISA CM G AMON AMARTH CINZA;PROFANUS;274;12,5;30;5;CMCMG00219;1;
Camisa ;com manga;AMON AMARTH CINZA;GG;Amon Amarth;;Amon Amarth Cinza;CAMISA CM GG AMON AMARTH CINZA;PROFANUS;274;12,5;30;6;CMCMGG00153;1;
Camisa ;com manga;AMON AMARTH MARTELO;M;Amon Amarth;;Amon Amarth Martelo;CAMISA CM M AMON AMARTH MARTELO;PROFANUS;167;12,5;30;4;CMCMM00208;1;
Camisa ;com manga;AMON AMARTH MARTELO;G;Amon Amarth;;Amon Amarth Martelo;CAMISA CM G AMON AMARTH MARTELO;PROFANUS;167;12,5;30;18;CMCMG00209;1;
Camisa ;com manga;AMON AMARTH MARTELO;GG;Amon Amarth;;Amon Amarth Martelo;CAMISA CM GG AMON AMARTH MARTELO;PROFANUS;167;12,5;30;8;CMCMGG00143;1;
Camisa ;com manga;AMON AMARTH VERSUS;M;Amon Amarth;;Amon Amarth Versus;CAMISA CM M AMON AMARTH VERSUS;BLACK ANGE;56;12;30;1;CMCMM00343;1;
Camisa ;com manga;AMON AMARTH VERSUS;G;Amon Amarth;;Amon Amarth Versus;CAMISA CM G AMON AMARTH VERSUS;BLACK ANGE;56;12;30;3;CMCMG00351;1;
Camisa ;com manga;AMON AMARTH VERSUS;GG;Amon Amarth;;Amon Amarth Versus;CAMISA CM GG AMON AMARTH VERSUS;BLACK ANGE;56;12;30;4;CMCMGG00270;1;
Camisa ;com manga;AMY CAVEIRA;P;Amy Winehouse;;Amy Caveira;CAMISA CM P AMY CAVEIRA;HCD;269;12,5;30;9;CMCMP00165;1;
Camisa ;com manga;AMY CAVEIRA;M;Amy Winehouse;;Amy Caveira;CAMISA CM M AMY CAVEIRA;HCD;269;12,5;30;5;CMCMM00162;1;
Camisa ;com manga;AMY CAVEIRA;G;Amy Winehouse;;Amy Caveira;CAMISA CM G AMY CAVEIRA;HCD;269;12,5;30;8;CMCMG00159;1;
Camisa ;com manga;AMY CAVEIRA;GG;Amy Winehouse;;Amy Caveira;CAMISA CM GG AMY CAVEIRA;HCD;269;12,5;30;9;CMCMGG00102;1;
Camisa ;com manga;ANGRA TEMPLE;M;Angra;;Angra Temple;CAMISA CM M ANGRA TEMPLE;MR;56;12,5;30;3;CMCMM00266;1;
Camisa ;com manga;ANGRA TEMPLE;G;Angra;;Angra Temple;CAMISA CM G ANGRA TEMPLE;MR;56;12,5;30;7;CMCMG00267;1;
Camisa ;com manga;ANGRA TEMPLE;GG;Angra;;Angra Temple;CAMISA CM GG ANGRA TEMPLE;MR;56;12,5;30;15;CMCMGG00198;1;
Camisa ;com manga;ANTHRAX LAW;M;Anthrax;;Anthrax Law;CAMISA CM M ANTHRAX LAW;BLACK ANGE;10;12,5;30;9;CMCMM00249;1;
Camisa ;com manga;ANTHRAX LAW;G;Anthrax;;Anthrax Law;CAMISA CM G ANTHRAX LAW;BLACK ANGE;10;12,5;30;4;CMCMG00251;1;
Camisa ;com manga;ANTHRAX LAW;GG;Anthrax;;Anthrax Law;CAMISA CM GG ANTHRAX LAW;BLACK ANGE;10;12,5;30;1;CMCMGG00184;1;
Camisa ;com manga;ARCTIC MONKEYS;P;Artic Monkeys;;Arctic Monkeys;CAMISA CM P ARCTIC MONKEYS;EQ;633;11;30;14;CMCMP00112;1;
Camisa ;com manga;ARCTIC MONKEYS;M;Artic Monkeys;;Arctic Monkeys;CAMISA CM M ARCTIC MONKEYS;EQ;633;11;30;7;CMCMM00110;1;
Camisa ;com manga;ASKING;M;Asking Alexandria;;Asking;CAMISA CM M ASKING;VIRUS;75;12,5;30;4;CMCMM00182;1;
Camisa ;com manga;ASKING;G;Asking Alexandria;;Asking;CAMISA CM G ASKING;VIRUS;75;12,5;30;1;CMCMG00180;1;
Camisa ;com manga;ASKING COBRA;P;Asking Alexandria;;Asking Cobra;CAMISA CM P ASKING COBRA;MR;207;13;30;8;CMCMP00334;1;
Camisa ;com manga;ASKING COBRA;M;Asking Alexandria;;Asking Cobra;CAMISA CM M ASKING COBRA;MR;207;13;30;3;CMCMM00402;1;
Camisa ;com manga;ASKING COBRA;G;Asking Alexandria;;Asking Cobra;CAMISA CM G ASKING COBRA;MR;207;13;30;4;CMCMG00412;1;
Camisa ;com manga;ASKING MULHER;P;Asking Alexandria;;Asking Mulher;CAMISA CM P ASKING MULHER;VIRUS;260;13;30;4;CMCMP00343;1;
Camisa ;com manga;ASKING MULHER;M;Asking Alexandria;;Asking Mulher;CAMISA CM M ASKING MULHER;VIRUS;260;12;30;6;CMCMM00388;1;
Camisa ;com manga;ASKING MULHER;G;Asking Alexandria;;Asking Mulher;CAMISA CM G ASKING MULHER;VIRUS;260;12;30;1;CMCMG00396;1;
Camisa ;com manga;ASSASSINS CREED;P;Games;;Assassins Creed;CAMISA CM P ASSASSINS CREED;HCD;301;12;30;4;CMCMP00300;1;
Camisa ;com manga;ASSASSINS CREED;M;Games;;Assassins Creed;CAMISA CM M ASSASSINS CREED;HCD;301;12;30;0;CMCMM00363;1;
Camisa ;com manga;ASSASSINS CREED;G;Games;;Assassins Creed;CAMISA CM G ASSASSINS CREED;HCD;301;12;30;6;CMCMG00371;1;
Camisa ;com manga;ASSASSINS CREED;GG;Games;;Assassins Creed;CAMISA CM GG ASSASSINS CREED;HCD;301;12;30;6;CMCMGG00288;1;
Camisa ;com manga;ASSASSINS CREED;XGG;Games;;Assassins Creed;CAMISA CM XGG ASSASSINS CREED;HCD;301;15;36;2;CMCMXGG00020;1;
Camisa ;com manga;ASSASSINS CREED FLAG;P;Games;;Assassins Creed Flag;CAMISA CM P ASSASSINS CREED FLAG;HCD;323;13,5;30;3;CMCMP00325;1;
Camisa ;com manga;ASSASSINS CREED FLAG;M;Games;;Assassins Creed Flag;CAMISA CM M ASSASSINS CREED FLAG;HCD;323;13,5;30;4;CMCMM00392;1;
Camisa ;com manga;ASSASSINS CREED FLAG;G;Games;;Assassins Creed Flag;CAMISA CM G ASSASSINS CREED FLAG;HCD;323;13,5;30;0;CMCMG00401;1;
Camisa ;com manga;ASSASSINS CREED FLAG;GG;Games;;Assassins Creed Flag;CAMISA CM GG ASSASSINS CREED FLAG;HCD;323;13,5;30;5;CMCMGG00316;1;
Camisa ;com manga;AVENGED BANDA AMARELA;P;Avenged Sevenfold;;Avenged Banda Amarela;CAMISA CM P AVENGED BANDA AMARELA;VIRUS;2;12,5;30;7;CMCMP00178;1;
Camisa ;com manga;AVENGED BANDA AMARELA;M;Avenged Sevenfold;;Avenged Banda Amarela;CAMISA CM M AVENGED BANDA AMARELA;VIRUS;2;12,5;30;5;CMCMM00174;1;
Camisa ;com manga;AVENGED BANDA AMARELA;G;Avenged Sevenfold;;Avenged Banda Amarela;CAMISA CM G AVENGED BANDA AMARELA;VIRUS;2;12,5;30;2;CMCMG00172;1;
Camisa ;com manga;AVENGED NIGHTMARE MASTER MASTER;P;Avenged Sevenfold;;Avenged Nightmare Master Master;CAMISA CM P AVENGED NIGHTMARE MASTER MASTER;MR;118;12,5;30;2;CMCMP00208;1;
Camisa ;com manga;AVENGED NIGHTMARE MASTER MASTER;M;Avenged Sevenfold;;Avenged Nightmare Master Master;CAMISA CM M AVENGED NIGHTMARE MASTER MASTER;MR;118;12,5;30;1;CMCMM00276;1;
Camisa ;com manga;AVENGED NIGHTMARE MASTER MASTER;G;Avenged Sevenfold;;Avenged Nightmare Master Master;CAMISA CM G AVENGED NIGHTMARE MASTER MASTER;MR;118;12,5;30;4;CMCMG00277;1;
Camisa ;com manga;AVENGED NIGHTMARE MASTER MASTER;GG;Avenged Sevenfold;;Avenged Nightmare Master Master;CAMISA CM GG AVENGED NIGHTMARE MASTER MASTER;MR;118;12,5;30;5;CMCMGG00205;1;
Camisa ;com manga;AVENGED TRADICIONAL;P;Avenged Sevenfold;;Avenged Tradicional;CAMISA CM P AVENGED TRADICIONAL;EQ;762;11;30;8;CMCMP00233;1;
Camisa ;com manga;AVENGED TRADICIONAL;M;Avenged Sevenfold;;Avenged Tradicional;CAMISA CM M AVENGED TRADICIONAL;EQ;762;11;30;6;CMCMM00313;1;
