Camisa ;com manga;NARUTO BRANCA VIRUS;M;Naruto;;Naruto Branca Virus;CAMISA CM M NARUTO BRANCA VIRUS;VIRUS;134;12;30;7;CMCMM00351;1;
Camisa ;com manga;NARUTO BRANCA VIRUS;G;Naruto;;Naruto Branca Virus;CAMISA CM G NARUTO BRANCA VIRUS;VIRUS;134;12;30;6;CMCMG00358;1;
Camisa ;com manga;NARUTO BRANCA VIRUS;GG;Naruto;;Naruto Branca Virus;CAMISA CM GG NARUTO BRANCA VIRUS;VIRUS;134;12;30;3;CMCMGG00276;1;
Camisa ;com manga;NIRVANA BANDA MASTER;M;Nirvana;;Nirvana Banda Master;CAMISA CM M NIRVANA BANDA MASTER;MR;178;12;30;6;CMCMM00360;1;
Camisa ;com manga;NIRVANA BANDA MASTER;G;Nirvana;;Nirvana Banda Master;CAMISA CM G NIRVANA BANDA MASTER;MR;178;12;30;1;CMCMG00368;1;
Camisa ;com manga;NIRVANA BANDA MASTER;GG;Nirvana;;Nirvana Banda Master;CAMISA CM GG NIRVANA BANDA MASTER;MR;178;12;30;7;CMCMGG00285;1;
Camisa ;com manga;NIRVANA BATERIA;P;Nirvana;;Nirvana Bateria;CAMISA CM P NIRVANA BATERIA;EQ;175;10,5;30;6;CMCMP00034;1;
Camisa ;com manga;NIRVANA BATERIA;M;Nirvana;;Nirvana Bateria;CAMISA CM M NIRVANA BATERIA;EQ;175;10,5;30;0;CMCMM00033;1;
Camisa ;com manga;NIRVANA BATERIA;G;Nirvana;;Nirvana Bateria;CAMISA CM G NIRVANA BATERIA;EQ;175;10,5;30;5;CMCMG00034;1;
Camisa ;com manga;NIRVANA BLEACH;P;Nirvana;;Nirvana Bleach;CAMISA CM P NIRVANA BLEACH;EQ;776;10,5;24;0;CMCMP00136;;
Camisa ;com manga;NIRVANA MALHA CINZA;P;Nirvana;;Nirvana Malha Cinza;CAMISA CM P NIRVANA MALHA CINZA;VIRUS;266;13;30;0;CMCMP00335;1;
Camisa ;com manga;NIRVANA MALHA CINZA;M;Nirvana;;Nirvana Malha Cinza;CAMISA CM M NIRVANA MALHA CINZA;VIRUS;266;13;30;0;CMCMM00404;1;
Camisa ;com manga;NIRVANA MALHA CINZA;G;Nirvana;;Nirvana Malha Cinza;CAMISA CM G NIRVANA MALHA CINZA;VIRUS;266;13;30;0;CMCMG00414;1;
Camisa ;com manga;NIRVANA NEVERMIND;P;Nirvana;;Nirvana Nevermind;CAMISA CM P NIRVANA NEVERMIND;MR;137;12,5;30;7;CMCMP00215;1;
Camisa ;com manga;NIRVANA NEVERMIND;M;Nirvana;;Nirvana Nevermind;CAMISA CM M NIRVANA NEVERMIND;MR;137;12,5;30;7;CMCMM00286;1;
Camisa ;com manga;NIRVANA NEVERMIND;G;Nirvana;;Nirvana Nevermind;CAMISA CM G NIRVANA NEVERMIND;MR;137;12,5;30;2;CMCMG00288;1;
Camisa ;com manga;NIRVANA NEVERMIND;GG;Nirvana;;Nirvana Nevermind;CAMISA CM GG NIRVANA NEVERMIND;MR;137;12,5;30;8;CMCMGG00210;1;
Camisa ;com manga;NIRVANA NEVERMIND ALBUM;P;Nirvana;;Nirvana Nevermind Album;CAMISA CM P NIRVANA NEVERMIND ALBUM;PROFANUS;440;13;30;4;CMCMP00330;1;
Camisa ;com manga;NIRVANA NEVERMIND ALBUM;M;Nirvana;;Nirvana Nevermind Album;CAMISA CM M NIRVANA NEVERMIND ALBUM;PROFANUS;440;13;30;0;CMCMM00397;1;
Camisa ;com manga;NIRVANA NEVERMIND ALBUM;G;Nirvana;;Nirvana Nevermind Album;CAMISA CM G NIRVANA NEVERMIND ALBUM;PROFANUS;440;13;30;3;CMCMG00406;1;
Camisa ;com manga;NIRVANA NEVERMIND ALBUM;GG;Nirvana;;Nirvana Nevermind Album;CAMISA CM GG NIRVANA NEVERMIND ALBUM;PROFANUS;440;13;30;0;CMCMGG00321;1;
Camisa ;com manga;NIRVANA SMILE;PP;Nirvana;;Nirvana Smile;CAMISA CM PP NIRVANA SMILE;AN;6;11;30;0;CMCMPP00014;1;
Camisa ;com manga;NIRVANA SMILE;P;Nirvana;;Nirvana Smile;CAMISA CM P NIRVANA SMILE;AN;6;11;30;11;CMCMP00236;1;
Camisa ;com manga;NIRVANA SMILE;M;Nirvana;;Nirvana Smile;CAMISA CM M NIRVANA SMILE;EQ;632;10,5;24;0;CMCMM00109;1;
Camisa ;com manga;NIRVANA SMILE;M;Nirvana;;Nirvana Smile;CAMISA CM M NIRVANA SMILE;AN;6;11;30;7;CMCMM00315;1;
Camisa ;com manga;NIRVANA SMILE;G;Nirvana;;Nirvana Smile;CAMISA CM G NIRVANA SMILE;AN;6;11;30;8;CMCMG00318;1;
Camisa ;com manga;NIRVANA SMILE;GG;Nirvana;;Nirvana Smile;CAMISA CM GG NIRVANA SMILE;AN;6;11;30;11;CMCMGG00238;1;
Camisa ;com manga;NOEL;P;Noel Rosa;;Noel;CAMISA CM P NOEL;HCD;S02;12,5;30;5;CMCMP00148;1;
Camisa ;com manga;NOEL;M;Noel Rosa;;Noel;CAMISA CM M NOEL;HCD;S02;12,5;30;0;CMCMM00148;1;
Camisa ;com manga;NOEL;G;Noel Rosa;;Noel;CAMISA CM G NOEL;HCD;S02;12,5;30;0;CMCMG00143;1;
Camisa ;com manga;NOEL;GG;Noel Rosa;;Noel;CAMISA CM GG NOEL;HCD;S02;12,5;30;1;CMCMGG00086;1;
Camisa ;com manga;OASIS;P;Oasis;;Oasis;CAMISA CM P OASIS;EQ;137;10,5;30;10;CMCMP00031;1;
Camisa ;com manga;OASIS;M;Oasis;;Oasis;CAMISA CM M OASIS;EQ;137;10,5;30;5;CMCMM00030;1;
Camisa ;com manga;OBITUARY ESTAMPA;M;Obituary;;Obituary Estampa;CAMISA CM M OBITUARY ESTAMPA;PROFANUS;282;12,5;30;7;CMCMM00221;1;
Camisa ;com manga;OBITUARY ESTAMPA;G;Obituary;;Obituary Estampa;CAMISA CM G OBITUARY ESTAMPA;PROFANUS;282;12,5;30;16;CMCMG00222;1;
Camisa ;com manga;OBITUARY ESTAMPA;GG;Obituary;;Obituary Estampa;CAMISA CM GG OBITUARY ESTAMPA;PROFANUS;282;12,5;30;12;CMCMGG00156;1;
Camisa ;com manga;OBITUARY LOGO;M;Obituary;;Obituary Logo;CAMISA CM M OBITUARY LOGO;PROFANUS;36;12,5;30;40;CMCMM00205;1;
Camisa ;com manga;OBITUARY LOGO;G;Obituary;;Obituary Logo;CAMISA CM G OBITUARY LOGO;PROFANUS;36;12,5;30;19;CMCMG00206;1;
Camisa ;com manga;OBITUARY LOGO;GG;Obituary;;Obituary Logo;CAMISA CM GG OBITUARY LOGO;PROFANUS;36;12,5;30;22;CMCMGG00140;1;
Camisa ;com manga;OFFSPRING P/B;P;The Offspring;;Offspring P/b;CAMISA CM P OFFSPRING P/B;EQ;399;10,5;30;0;CMCMP00077;1;
Camisa ;com manga;OFFSPRING P/B;M;The Offspring;;Offspring P/b;CAMISA CM M OFFSPRING P/B;EQ;399;10,5;30;0;CMCMM00076;1;
Camisa ;com manga;OFFSPRING P/B;G;The Offspring;;Offspring P/b;CAMISA CM G OFFSPRING P/B;EQ;399;10,5;30;0;CMCMG00075;1;
Camisa ;com manga;ONE PIECE PRETA HCD;P;One Piece;;One Piece Preta Hcd;CAMISA CM P ONE PIECE PRETA HCD;HCD;293;12;30;6;CMCMP00295;1;
Camisa ;com manga;ONE PIECE PRETA HCD;M;One Piece;;One Piece Preta Hcd;CAMISA CM M ONE PIECE PRETA HCD;HCD;293;12;30;5;CMCMM00356;1;
Camisa ;com manga;ONE PIECE PRETA HCD;G;One Piece;;One Piece Preta Hcd;CAMISA CM G ONE PIECE PRETA HCD;HCD;293;12;30;6;CMCMG00364;1;
Camisa ;com manga;ONE PIECE PRETA HCD;GG;One Piece;;One Piece Preta Hcd;CAMISA CM GG ONE PIECE PRETA HCD;HCD;293;12;30;9;CMCMGG00281;1;
Camisa ;com manga;ONE PIECE PRETA HCD;XGG;One Piece;;One Piece Preta Hcd;CAMISA CM XGG ONE PIECE PRETA HCD;HCD;293;15;36;0;CMCMXGG00045;1;
Camisa ;com manga;ONE PIECE PRETA VIRUS;P;One Piece;;One Piece Preta Virus;CAMISA CM P ONE PIECE PRETA VIRUS;VIRUS;120;13;30;4;CMCMP00304;1;
Camisa ;com manga;ONE PIECE PRETA VIRUS;M;One Piece;;One Piece Preta Virus;CAMISA CM M ONE PIECE PRETA VIRUS;VIRUS;120;13;30;8;CMCMM00369;1;
Camisa ;com manga;ONE PIECE PRETA VIRUS;G;One Piece;;One Piece Preta Virus;CAMISA CM G ONE PIECE PRETA VIRUS;VIRUS;120;13;30;7;CMCMG00377;1;
Camisa ;com manga;ONE PIECE PRETA VIRUS;GG;One Piece;;One Piece Preta Virus;CAMISA CM GG ONE PIECE PRETA VIRUS;VIRUS;120;13;30;4;CMCMGG00294;1;
Camisa ;com manga;OZZY MORCEGO;M;Ozzy Osbourne;;Ozzy Morcego;CAMISA CM M OZZY MORCEGO;PROFANUS;307;12,5;30;0;CMCMM00228;1;
Camisa ;com manga;OZZY MORCEGO;G;Ozzy Osbourne;;Ozzy Morcego;CAMISA CM G OZZY MORCEGO;PROFANUS;307;12,5;30;0;CMCMG00229;1;
Camisa ;com manga;OZZY MORCEGO;GG;Ozzy Osbourne;;Ozzy Morcego;CAMISA CM GG OZZY MORCEGO;PROFANUS;307;12,5;30;6;CMCMGG00163;1;
Camisa ;com manga;PANTERA COWBOYS;M;Pantera;;Pantera Cowboys;CAMISA CM M PANTERA COWBOYS;PROFANUS;335;12,5;30;1;CMCMM00232;1;
Camisa ;com manga;PANTERA COWBOYS;G;Pantera;;Pantera Cowboys;CAMISA CM G PANTERA COWBOYS;PROFANUS;335;12,5;30;5;CMCMG00233;1;
Camisa ;com manga;PANTERA COWBOYS;GG;Pantera;;Pantera Cowboys;CAMISA CM GG PANTERA COWBOYS;PROFANUS;335;12,5;30;6;CMCMGG00167;1;
Camisa ;com manga;PANTERA OFFICIAL;P;Pantera;;Pantera Official;CAMISA CM P PANTERA OFFICIAL;EQ;766;10,5;30;15;CMCMP00129;1;
Camisa ;com manga;PANTERA OFFICIAL;M;Pantera;;Pantera Official;CAMISA CM M PANTERA OFFICIAL;EQ;766;11;30;8;CMCMM00140;1;
Camisa ;com manga;PANTERA OFFICIAL;G;Pantera;;Pantera Official;CAMISA CM G PANTERA OFFICIAL;EQ;766;10,5;30;4;CMCMG00124;1;
Camisa ;com manga;PANTERA OFFICIAL;GG;Pantera;;Pantera Official;CAMISA CM GG PANTERA OFFICIAL;EQ;766;11;30;7;CMCMGG00071;1;
Camisa ;com manga;PANTERA SOCO;P;Pantera;;Pantera Soco;CAMISA CM P PANTERA SOCO;EQ;90;10,5;30;0;CMCMP00015;1;
Camisa ;com manga;PANTERA SOCO;M;Pantera;;Pantera Soco;CAMISA CM M PANTERA SOCO;EQ;90;10,5;30;0;CMCMM00014;1;
Camisa ;com manga;PANTERA SOCO;G;Pantera;;Pantera Soco;CAMISA CM G PANTERA SOCO;EQ;90;10,5;30;0;CMCMG00015;1;
Camisa ;com manga;PANTERA SOCO;GG;Pantera;;Pantera Soco;CAMISA CM GG PANTERA SOCO;EQ;90;10,5;30;1;CMCMGG00011;1;
Camisa ;com manga;PASSARO VERMELHO;PP;Angry Birds;;Passaro Vermelho;CAMISA CM PP PASSARO VERMELHO;AN;14;12;30;15;CMCMPP00013;1;
Camisa ;com manga;PASSARO VERMELHO;P;Angry Birds;;Passaro Vermelho;CAMISA CM P PASSARO VERMELHO;AN;14;12;30;12;CMCMP00286;1;
Camisa ;com manga;PASSARO VERMELHO;M;Angry Birds;;Passaro Vermelho;CAMISA CM M PASSARO VERMELHO;AN;14;12;30;7;CMCMM00341;1;
Camisa ;com manga;PASSARO VERMELHO;G;Angry Birds;;Passaro Vermelho;CAMISA CM G PASSARO VERMELHO;AN;14;12;30;9;CMCMG00345;1;
Camisa ;com manga;PASSARO VERMELHO;GG;Angry Birds;;Passaro Vermelho;CAMISA CM GG PASSARO VERMELHO;AN;14;12;30;15;CMCMGG00266;1;
Camisa ;com manga;PEARL;P;Pearl Jam;;Pearl;CAMISA CM P PEARL;EQ;416;11;30;7;CMCMP00081;1;
Camisa ;com manga;PEARL;M;Pearl Jam;;Pearl;CAMISA CM M PEARL;EQ;416;10,5;30;8;CMCMM00080;1;
Camisa ;com manga;PEARL;G;Pearl Jam;;Pearl;CAMISA CM G PEARL;EQ;416;11;30;10;CMCMG00079;1;
Camisa ;com manga;PEARL JAM BONEQUINHO;P;Pearl Jam;;Pearl Jam Bonequinho;CAMISA CM P PEARL JAM BONEQUINHO;EQ;91;11;30;10;CMCMP00016;1;
Camisa ;com manga;PEARL JAM BONEQUINHO;M;Pearl Jam;;Pearl Jam Bonequinho;CAMISA CM M PEARL JAM BONEQUINHO;EQ;91;10,5;30;9;CMCMM00015;1;
Camisa ;com manga;PEARL JAM BONEQUINHO;G;Pearl Jam;;Pearl Jam Bonequinho;CAMISA CM G PEARL JAM BONEQUINHO;EQ;91;11;30;6;CMCMG00016;1;
Camisa ;com manga;PEARL JAM BONEQUINHO;GG;Pearl Jam;;Pearl Jam Bonequinho;CAMISA CM GG PEARL JAM BONEQUINHO;EQ;91;11;30;6;CMCMGG00012;1;
Camisa ;com manga;PINK FLOYD BANDA;M;Pink Floyd;;Pink Floyd Banda;CAMISA CM M PINK FLOYD BANDA;MR;210;13;30;4;CMCMM00403;1;
Camisa ;com manga;PINK FLOYD BANDA;G;Pink Floyd;;Pink Floyd Banda;CAMISA CM G PINK FLOYD BANDA;MR;210;13;30;3;CMCMG00413;1;
Camisa ;com manga;PINK FLOYD BANDA;GG;Pink Floyd;;Pink Floyd Banda;CAMISA CM GG PINK FLOYD BANDA;MR;210;13;30;2;CMCMGG00326;1;
Camisa ;com manga;PINK FLOYD DESENHO;P;Pink Floyd;;Pink Floyd Desenho;CAMISA CM P PINK FLOYD DESENHO;PROFANUS;336;12,5;30;0;CMCMP00196;1;
Camisa ;com manga;PINK FLOYD DESENHO;M;Pink Floyd;;Pink Floyd Desenho;CAMISA CM M PINK FLOYD DESENHO;PROFANUS;336;12,5;30;-3;CMCMM00233;1;
Camisa ;com manga;PINK FLOYD DESENHO;G;Pink Floyd;;Pink Floyd Desenho;CAMISA CM G PINK FLOYD DESENHO;PROFANUS;336;12,5;30;2;CMCMG00234;1;
Camisa ;com manga;PINK FLOYD DESENHO;GG;Pink Floyd;;Pink Floyd Desenho;CAMISA CM GG PINK FLOYD DESENHO;PROFANUS;336;12,5;30;3;CMCMGG00168;1;
Camisa ;com manga;PINK FLOYD DIVISION;G;Pink Floyd;;Pink Floyd Division;CAMISA CM G PINK FLOYD DIVISION;VIRUS;290;13;30;0;CMCMG00410;1;
Camisa ;com manga;PINK FLOYD DIVISION;GG;Pink Floyd;;Pink Floyd Division;CAMISA CM GG PINK FLOYD DIVISION;VIRUS;290;13;30;0;CMCMGG00324;1;
Camisa ;com manga;PINK FLOYD PRISMA;P;Pink Floyd;;Pink Floyd Prisma;CAMISA CM P PINK FLOYD PRISMA;EQ;92;11;30;11;CMCMP00017;1;
Camisa ;com manga;PINK FLOYD PRISMA;M;Pink Floyd;;Pink Floyd Prisma;CAMISA CM M PINK FLOYD PRISMA;EQ;92;10,5;30;10;CMCMM00016;1;
Camisa ;com manga;PINK FLOYD PRISMA;G;Pink Floyd;;Pink Floyd Prisma;CAMISA CM G PINK FLOYD PRISMA;EQ;92;10,5;30;10;CMCMG00017;1;
Camisa ;com manga;PINK FLOYD PRISMA;GG;Pink Floyd;;Pink Floyd Prisma;CAMISA CM GG PINK FLOYD PRISMA;EQ;92;10,5;30;8;CMCMGG00013;1;
Camisa ;com manga;PINK FLOYD PRISMA BANDA;P;Pink Floyd;;Pink Floyd Prisma Banda;CAMISA CM P PINK FLOYD PRISMA BANDA;VIRUS;66;12,5;30;0;CMCMP00182;1;
Camisa ;com manga;PINK FLOYD PRISMA BANDA;M;Pink Floyd;;Pink Floyd Prisma Banda;CAMISA CM M PINK FLOYD PRISMA BANDA;VIRUS;66;12,5;30;0;CMCMM00181;1;
Camisa ;com manga;PINK FLOYD PRISMA BANDA;G;Pink Floyd;;Pink Floyd Prisma Banda;CAMISA CM G PINK FLOYD PRISMA BANDA;VIRUS;66;12,5;30;0;CMCMG00179;1;
Camisa ;com manga;PINK FLOYD PRISMA BANDA;GG;Pink Floyd;;Pink Floyd Prisma Banda;CAMISA CM GG PINK FLOYD PRISMA BANDA;VIRUS;66;12,5;30;0;CMCMGG00119;1;
Camisa ;com manga;PINK FLOYD THE WALL BRANCA;P;Pink Floyd;;Pink Floyd The Wall Branca;CAMISA CM P PINK FLOYD THE WALL BRANCA;EQ;335;11;30;8;CMCMP00055;1;
Camisa ;com manga;PINK FLOYD THE WALL BRANCA;M;Pink Floyd;;Pink Floyd The Wall Branca;CAMISA CM M PINK FLOYD THE WALL BRANCA;EQ;335;10,5;30;9;CMCMM00055;1;
Camisa ;com manga;PINK FLOYD THE WALL BRANCA;G;Pink Floyd;;Pink Floyd The Wall Branca;CAMISA CM G PINK FLOYD THE WALL BRANCA;EQ;335;10,5;30;8;CMCMG00055;1;
Camisa ;com manga;PINK FLOYD THE WALL BRANCA;GG;Pink Floyd;;Pink Floyd The Wall Branca;CAMISA CM GG PINK FLOYD THE WALL BRANCA;EQ;335;10,5;30;11;CMCMGG00036;1;
Camisa ;com manga;PINK FLOYD WALL PRETA;P;Pink Floyd;;Pink Floyd Wall Preta;CAMISA CM P PINK FLOYD WALL PRETA;MR;135;12,5;30;8;CMCMP00214;1;
Camisa ;com manga;PINK FLOYD WALL PRETA;M;Pink Floyd;;Pink Floyd Wall Preta;CAMISA CM M PINK FLOYD WALL PRETA;MR;135;12,5;30;3;CMCMM00285;1;
Camisa ;com manga;PINK FLOYD WALL PRETA;G;Pink Floyd;;Pink Floyd Wall Preta;CAMISA CM G PINK FLOYD WALL PRETA;MR;135;12,5;30;2;CMCMG00287;1;
Camisa ;com manga;PINK FLOYD WALL PRETA;GG;Pink Floyd;;Pink Floyd Wall Preta;CAMISA CM GG PINK FLOYD WALL PRETA;MR;135;12,5;30;2;CMCMGG00209;1;
Camisa ;com manga;PIRATAS DO CARIBE;P;Filmes;;Piratas Do Caribe;CAMISA CM P PIRATAS DO CARIBE;MR;200;12;30;5;CMCMP00308;1;
Camisa ;com manga;PIRATAS DO CARIBE;M;Filmes;;Piratas Do Caribe;CAMISA CM M PIRATAS DO CARIBE;MR;200;12;30;6;CMCMM00372;1;
Camisa ;com manga;PIRATAS DO CARIBE;G;Filmes;;Piratas Do Caribe;CAMISA CM G PIRATAS DO CARIBE;MR;200;12;30;2;CMCMG00380;1;
Camisa ;com manga;PIRATAS DO CARIBE;GG;Filmes;;Piratas Do Caribe;CAMISA CM GG PIRATAS DO CARIBE;MR;200;12;30;2;CMCMGG00298;1;
Camisa ;com manga;PIXINGUINHA;P;Pixinguinha;;Pixinguinha;CAMISA CM P PIXINGUINHA;HCD;S 08;12;30;9;CMCMP00249;1;
Camisa ;com manga;PIXINGUINHA;M;Pixinguinha;;Pixinguinha;CAMISA CM M PIXINGUINHA;HCD;S 08;12;30;8;CMCMM00323;1;
Camisa ;com manga;PIXINGUINHA;G;Pixinguinha;;Pixinguinha;CAMISA CM G PIXINGUINHA;HCD;S 08;12;30;6;CMCMG00327;1;
Camisa ;com manga;PIXINGUINHA;GG;Pixinguinha;;Pixinguinha;CAMISA CM GG PIXINGUINHA;HCD;S 08;12;30;2;CMCMGG00247;1;
Camisa ;com manga;PODEROSO CHEFAO;P;O Poderoso Chefao;;Poderoso Chefao;CAMISA CM P PODEROSO CHEFAO;EQ;627;11;30;10;CMCMP00110;1;
Camisa ;com manga;PODEROSO CHEFAO;M;O Poderoso Chefao;;Poderoso Chefao;CAMISA CM M PODEROSO CHEFAO;EQ;627;11;30;8;CMCMM00108;1;
Camisa ;com manga;PODEROSO CHEFAO;G;O Poderoso Chefao;;Poderoso Chefao;CAMISA CM G PODEROSO CHEFAO;EQ;627;11;30;10;CMCMG00106;1;
Camisa ;com manga;PODEROSO CHEFAO;GG;O Poderoso Chefao;;Poderoso Chefao;CAMISA CM GG PODEROSO CHEFAO;EQ;627;11;30;11;CMCMGG00057;1;
Camisa ;com manga;QUEEN DOURADA;P;Queen;;Queen Dourada;CAMISA CM P QUEEN DOURADA;EQ;794;11;30;8;CMCMP00142;1;
Camisa ;com manga;QUEEN DOURADA;M;Queen;;Queen Dourada;CAMISA CM M QUEEN DOURADA;EQ;794;10,5;30;9;CMCMM00141;1;
Camisa ;com manga;QUEEN DOURADA;G;Queen;;Queen Dourada;CAMISA CM G QUEEN DOURADA;EQ;794;11;30;10;CMCMG00137;1;
Camisa ;com manga;QUEEN DOURADA;GG;Queen;;Queen Dourada;CAMISA CM GG QUEEN DOURADA;EQ;794;10,5;30;9;CMCMGG00080;1;
Camisa ;com manga;RAGE AGAINST BRANCA;M;Rage Against the Machine;;Rage Against Branca;CAMISA CM M RAGE AGAINST BRANCA;PROFANUS;191;12,5;30;0;CMCMM00211;1;
Camisa ;com manga;RAGE AGAINST BRANCA;G;Rage Against the Machine;;Rage Against Branca;CAMISA CM G RAGE AGAINST BRANCA;PROFANUS;191;12,5;30;0;CMCMG00212;1;
Camisa ;com manga;RAGE AGAINST BRANCA;GG;Rage Against the Machine;;Rage Against Branca;CAMISA CM GG RAGE AGAINST BRANCA;PROFANUS;191;12,5;30;-1;CMCMGG00146;1;
Camisa ;com manga;RAINBOW LONG LIVE;M;Rainbow;;Rainbow Long Live;CAMISA CM M RAINBOW LONG LIVE;BLACK ANGE;359;12;30;8;CMCMM00328;1;
Camisa ;com manga;RAINBOW LONG LIVE;G;Rainbow;;Rainbow Long Live;CAMISA CM G RAINBOW LONG LIVE;BLACK ANGE;359;12;30;4;CMCMG00331;1;
Camisa ;com manga;RAINBOW LONG LIVE;GG;Rainbow;;Rainbow Long Live;CAMISA CM GG RAINBOW LONG LIVE;BLACK ANGE;359;12;30;11;CMCMGG00267;1;
Camisa ;com manga;RAINBOW LONG LIVE;XGG;Rainbow;;Rainbow Long Live;CAMISA CM XGG RAINBOW LONG LIVE;BLACK ANGE;359;13;30;10;CMCMXGG00005;1;
Camisa ;com manga;RAINBOW RISING;M;Rainbow;;Rainbow Rising;CAMISA CM M RAINBOW RISING;PROFANUS;344;12,5;30;9;CMCMM00237;1;
Camisa ;com manga;RAINBOW RISING;G;Rainbow;;Rainbow Rising;CAMISA CM G RAINBOW RISING;PROFANUS;344;12,5;30;10;CMCMG00238;1;
Camisa ;com manga;RAINBOW RISING;GG;Rainbow;;Rainbow Rising;CAMISA CM GG RAINBOW RISING;PROFANUS;344;12,5;30;9;CMCMGG00172;1;
Camisa ;com manga;RAINBOW RISING;XGG;Rainbow;;Rainbow Rising;CAMISA CM XGG RAINBOW RISING;PROFANUS;344;13;30;3;CMCMXGG00008;1;
Camisa ;com manga;RAMMSTEIN;M;Rammstein;;Rammstein;CAMISA CM M RAMMSTEIN;MR;141;12,5;30;1;CMCMM00289;1;
Camisa ;com manga;RAMMSTEIN;G;Rammstein;;Rammstein;CAMISA CM G RAMMSTEIN;MR;141;12,5;30;4;CMCMG00291;1;
Camisa ;com manga;RAMMSTEIN;GG;Rammstein;;Rammstein;CAMISA CM GG RAMMSTEIN;MR;141;12,5;30;6;CMCMGG00213;1;
Camisa ;com manga;RAMONES BANDA BRANCA;M;Ramones;;Ramones Banda Branca;CAMISA CM M RAMONES BANDA BRANCA;PROFANUS;237;12,5;30;0;CMCMM00214;1;
Camisa ;com manga;RAMONES BANDA BRANCA;G;Ramones;;Ramones Banda Branca;CAMISA CM G RAMONES BANDA BRANCA;PROFANUS;237;12,5;30;-4;CMCMG00215;1;
Camisa ;com manga;RAMONES BANDA BRANCA;GG;Ramones;;Ramones Banda Branca;CAMISA CM GG RAMONES BANDA BRANCA;PROFANUS;237;12,5;30;3;CMCMGG00149;1;
Camisa ;com manga;RAMONES PROCURADOS;M;Ramones;;Ramones Procurados;CAMISA CM M RAMONES PROCURADOS;VIRUS;46;12,5;30;2;CMCMM00180;1;
Camisa ;com manga;RAMONES PROCURADOS;G;Ramones;;Ramones Procurados;CAMISA CM G RAMONES PROCURADOS;VIRUS;46;12,5;30;3;CMCMG00178;1;
Camisa ;com manga;RAMONES PROCURADOS;GG;Ramones;;Ramones Procurados;CAMISA CM GG RAMONES PROCURADOS;VIRUS;46;12,5;30;15;CMCMGG00118;1;
Camisa ;com manga;RAMONES TRADICIONAL BRANCA;P;Ramones;;Ramones Tradicional Branca;CAMISA CM P RAMONES TRADICIONAL BRANCA;EQ;787;11;30;9;CMCMP00145;1;
Camisa ;com manga;RAMONES TRADICIONAL BRANCA;M;Ramones;;Ramones Tradicional Branca;CAMISA CM M RAMONES TRADICIONAL BRANCA;EQ;787;10,5;30;5;CMCMM00144;1;
Camisa ;com manga;RAMONES TRADICIONAL BRANCA;G;Ramones;;Ramones Tradicional Branca;CAMISA CM G RAMONES TRADICIONAL BRANCA;EQ;787;11;30;9;CMCMG00140;1;
Camisa ;com manga;RAMONES TRADICIONAL BRANCA;GG;Ramones;;Ramones Tradicional Branca;CAMISA CM GG RAMONES TRADICIONAL BRANCA;EQ;787;10,5;30;6;CMCMGG00084;1;
Camisa ;com manga;RAMONES TRADICIONAL PRETA;PP;Ramones;;Ramones Tradicional Preta;CAMISA CM PP RAMONES TRADICIONAL PRETA;AN;7;11;30;0;CMCMPP00001;1;
Camisa ;com manga;RAMONES TRADICIONAL PRETA;P;Ramones;;Ramones Tradicional Preta;CAMISA CM P RAMONES TRADICIONAL PRETA;AN;7;11;30;22;CMCMP00222;1;
Camisa ;com manga;RAMONES TRADICIONAL PRETA;M;Ramones;;Ramones Tradicional Preta;CAMISA CM M RAMONES TRADICIONAL PRETA;AN;7;11;30;11;CMCMM00301;1;
Camisa ;com manga;RAMONES TRADICIONAL PRETA;G;Ramones;;Ramones Tradicional Preta;CAMISA CM G RAMONES TRADICIONAL PRETA;AN;7;1;30;10;CMCMG00304;1;
Camisa ;com manga;RAMONES TRADICIONAL PRETA;GG;Ramones;;Ramones Tradicional Preta;CAMISA CM GG RAMONES TRADICIONAL PRETA;AN;7;11;30;8;CMCMGG00224;1;
Camisa ;com manga;RAUL CHAVE;P;Raul Seixas;;Raul Chave;CAMISA CM P RAUL CHAVE;EQ;103;10,5;30;11;CMCMP00020;1;
Camisa ;com manga;RAUL CHAVE;M;Raul Seixas;;Raul Chave;CAMISA CM M RAUL CHAVE;EQ;103;11;30;7;CMCMM00020;1;
Camisa ;com manga;RAUL CHAVE;G;Raul Seixas;;Raul Chave;CAMISA CM G RAUL CHAVE;EQ;103;11;30;5;CMCMG00021;1;
Camisa ;com manga;RAUL CHAVE;GG;Raul Seixas;;Raul Chave;CAMISA CM GG RAUL CHAVE;EQ;103;11;30;9;CMCMGG00016;1;
Camisa ;com manga;RAUL ROSTO;M;Raul Seixas;;Raul Rosto;CAMISA CM M RAUL ROSTO;EQ;259;10,5;24;0;CMCMM00048;;
Camisa ;com manga;RED HOT BRANCA;P;Red Hot Chili Peppers;;Red Hot Branca;CAMISA CM P RED HOT BRANCA;VIRUS;94;12,5;30;5;CMCMP00184;1;
Camisa ;com manga;RED HOT BRANCA;M;Red Hot Chili Peppers;;Red Hot Branca;CAMISA CM M RED HOT BRANCA;VIRUS;94;12,5;30;0;CMCMM00184;1;
Camisa ;com manga;RED HOT BRANCA;G;Red Hot Chili Peppers;;Red Hot Branca;CAMISA CM G RED HOT BRANCA;VIRUS;94;12,5;30;0;CMCMG00182;1;
Camisa ;com manga;RED HOT BRANCA;GG;Red Hot Chili Peppers;;Red Hot Branca;CAMISA CM GG RED HOT BRANCA;VIRUS;94;12,5;30;7;CMCMGG00121;1;
Camisa ;com manga;RED HOT PRETA;PP;Red Hot Chili Peppers;;Red Hot Preta;CAMISA CM PP RED HOT PRETA;AN;1;11;30;0;CMCMPP00006;1;
Camisa ;com manga;RED HOT PRETA;P;Red Hot Chili Peppers;;Red Hot Preta;CAMISA CM P RED HOT PRETA;AN;1;11;30;11;CMCMP00229;1;
Camisa ;com manga;RED HOT PRETA;M;Red Hot Chili Peppers;;Red Hot Preta;CAMISA CM M RED HOT PRETA;AN;1;11;30;9;CMCMM00309;1;
Camisa ;com manga;RED HOT PRETA;G;Red Hot Chili Peppers;;Red Hot Preta;CAMISA CM G RED HOT PRETA;AN;1;11;30;21;CMCMG00312;1;
Camisa ;com manga;RED HOT PRETA;GG;Red Hot Chili Peppers;;Red Hot Preta;CAMISA CM GG RED HOT PRETA;AN;1;11;30;14;CMCMGG00232;1;
Camisa ;com manga;RUSH CORUJA;P;Rush;;Rush Coruja;CAMISA CM P RUSH CORUJA;EQ;356;10,5;30;9;CMCMP00063;1;
Camisa ;com manga;RUSH CORUJA;M;Rush;;Rush Coruja;CAMISA CM M RUSH CORUJA;EQ;356;10,5;30;5;CMCMM00063;1;
Camisa ;com manga;RUSH CORUJA;G;Rush;;Rush Coruja;CAMISA CM G RUSH CORUJA;EQ;356;11;30;10;CMCMG00063;1;
Camisa ;com manga;RUSH CORUJA;GG;Rush;;Rush Coruja;CAMISA CM GG RUSH CORUJA;EQ;356;11;30;7;CMCMGG00040;1;
Camisa ;com manga;RUSH ESTRELA;P;Rush;;Rush Estrela;CAMISA CM P RUSH ESTRELA;EQ;230;10,5;30;6;CMCMP00040;1;
Camisa ;com manga;RUSH ESTRELA;M;Rush;;Rush Estrela;CAMISA CM M RUSH ESTRELA;EQ;230;10,5;30;6;CMCMM00039;1;
Camisa ;com manga;RUSH ESTRELA;G;Rush;;Rush Estrela;CAMISA CM G RUSH ESTRELA;EQ;230;11;30;5;CMCMG00040;1;
Camisa ;com manga;RUSH ESTRELA;GG;Rush;;Rush Estrela;CAMISA CM GG RUSH ESTRELA;EQ;230;10,5;24;4;CMCMGG00028;1;
Camisa ;com manga;RUSH MOVING PICTURES;P;Rush;;Rush Moving Pictures;CAMISA CM P RUSH MOVING PICTURES;EQ;358;10,5;30;17;CMCMP00065;1;
Camisa ;com manga;RUSH MOVING PICTURES;M;Rush;;Rush Moving Pictures;CAMISA CM M RUSH MOVING PICTURES;EQ;358;10,5;30;6;CMCMM00065;1;
Camisa ;com manga;RUSH MOVING PICTURES;G;Rush;;Rush Moving Pictures;CAMISA CM G RUSH MOVING PICTURES;EQ;358;10,5;30;7;CMCMG00065;1;
Camisa ;com manga;RUSH MOVING PICTURES;GG;Rush;;Rush Moving Pictures;CAMISA CM GG RUSH MOVING PICTURES;EQ;358;11;30;7;CMCMGG00041;1;
Camisa ;com manga;SARCOFAGO ROTTING;M;Sarcofago;;Sarcofago Rotting;CAMISA CM M SARCOFAGO ROTTING;BLACK ANGE;20;12,5;30;3;CMCMM00252;1;
Camisa ;com manga;SARCOFAGO ROTTING;G;Sarcofago;;Sarcofago Rotting;CAMISA CM G SARCOFAGO ROTTING;BLACK ANGE;20;12,5;30;7;CMCMG00254;1;
Camisa ;com manga;SARCOFAGO ROTTING;GG;Sarcofago;;Sarcofago Rotting;CAMISA CM GG SARCOFAGO ROTTING;BLACK ANGE;20;12,5;30;7;CMCMGG00187;1;
Camisa ;com manga;SARCOFAGO SCOURGE;M;Sarcofago;;Sarcofago Scourge;CAMISA CM M SARCOFAGO SCOURGE;BLACK ANGE;21;12,5;30;3;CMCMM00253;1;
Camisa ;com manga;SARCOFAGO SCOURGE;G;Sarcofago;;Sarcofago Scourge;CAMISA CM G SARCOFAGO SCOURGE;BLACK ANGE;21;12,5;30;4;CMCMG00255;1;
Camisa ;com manga;SARCOFAGO SCOURGE;GG;Sarcofago;;Sarcofago Scourge;CAMISA CM GG SARCOFAGO SCOURGE;BLACK ANGE;21;12,5;30;8;CMCMGG00188;1;
Camisa ;com manga;SCORPIONS IN TRANCE;M;Scorpions;;Scorpions In Trance;CAMISA CM M SCORPIONS IN TRANCE;PROFANUS;306;12,5;30;6;CMCMM00227;1;
Camisa ;com manga;SCORPIONS IN TRANCE;G;Scorpions;;Scorpions In Trance;CAMISA CM G SCORPIONS IN TRANCE;PROFANUS;306;12,5;30;8;CMCMG00228;1;
Camisa ;com manga;SCORPIONS IN TRANCE;GG;Scorpions;;Scorpions In Trance;CAMISA CM GG SCORPIONS IN TRANCE;PROFANUS;306;12,5;30;10;CMCMGG00162;1;
Camisa ;com manga;SEPULTURA REMAINS;M;Sepultura;;Sepultura Remains;CAMISA CM M SEPULTURA REMAINS;BLACK ANGE;18;12,5;30;8;CMCMM00251;1;
Camisa ;com manga;SEPULTURA REMAINS;G;Sepultura;;Sepultura Remains;CAMISA CM G SEPULTURA REMAINS;BLACK ANGE;18;12,5;30;10;CMCMG00253;1;
Camisa ;com manga;SEPULTURA REMAINS;GG;Sepultura;;Sepultura Remains;CAMISA CM GG SEPULTURA REMAINS;BLACK ANGE;18;12,5;30;8;CMCMGG00186;1;
Camisa ;com manga;SEPULTURA ROOTS;P;Sepultura;;Sepultura Roots;CAMISA CM P SEPULTURA ROOTS;VIRUS;251;12;30;5;CMCMP00312;1;
Camisa ;com manga;SEPULTURA ROOTS;M;Sepultura;;Sepultura Roots;CAMISA CM M SEPULTURA ROOTS;VIRUS;251;12;30;3;CMCMM00378;1;
Camisa ;com manga;SEPULTURA ROOTS;G;Sepultura;;Sepultura Roots;CAMISA CM G SEPULTURA ROOTS;VIRUS;251;12;30;0;CMCMG00386;1;
Camisa ;com manga;SEPULTURA ROOTS;GG;Sepultura;;Sepultura Roots;CAMISA CM GG SEPULTURA ROOTS;VIRUS;251;12;30;5;CMCMGG00304;1;
Camisa ;com manga;SEPULTURA ROOTS;XGG;Sepultura;;Sepultura Roots;CAMISA CM XGG SEPULTURA ROOTS;VIRUS;251;12;30;5;CMCMXGG00016;1;
Camisa ;com manga;SEPULTURA S;M;Sepultura;;Sepultura S;CAMISA CM M SEPULTURA S;PROFANUS;182;12,5;30;7;CMCMM00209;1;
Camisa ;com manga;SEPULTURA S;G;Sepultura;;Sepultura S;CAMISA CM G SEPULTURA S;PROFANUS;182;12,5;30;2;CMCMG00210;1;
Camisa ;com manga;SEPULTURA S;GG;Sepultura;;Sepultura S;CAMISA CM GG SEPULTURA S;PROFANUS;182;12,5;30;9;CMCMGG00144;1;
Camisa ;com manga;SEX PISTOLS AMARELA;P;Sex Pistols;;Sex Pistols Amarela;CAMISA CM P SEX PISTOLS AMARELA;EQ;682;11;30;0;CMCMP00119;1;
Camisa ;com manga;SEX PISTOLS AMARELA;M;Sex Pistols;;Sex Pistols Amarela;CAMISA CM M SEX PISTOLS AMARELA;EQ;682;10,5;30;9;CMCMM00117;1;
Camisa ;com manga;SEX PISTOLS AMARELA;G;Sex Pistols;;Sex Pistols Amarela;CAMISA CM G SEX PISTOLS AMARELA;EQ;682;11;30;9;CMCMG00114;1;
Camisa ;com manga;SEX PISTOLS AMARELA;GG;Sex Pistols;;Sex Pistols Amarela;CAMISA CM GG SEX PISTOLS AMARELA;EQ;682;11;30;5;CMCMGG00064;1;
Camisa ;com manga;SEX PISTOLS FANTA;P;Sex Pistols;;Sex Pistols Fanta;CAMISA CM P SEX PISTOLS FANTA;EQ;111;11;30;5;CMCMP00023;1;
Camisa ;com manga;SEX PISTOLS FANTA;M;Sex Pistols;;Sex Pistols Fanta;CAMISA CM M SEX PISTOLS FANTA;EQ;111;10,5;30;7;CMCMM00023;1;
Camisa ;com manga;SEX PISTOLS FANTA;G;Sex Pistols;;Sex Pistols Fanta;CAMISA CM G SEX PISTOLS FANTA;EQ;111;10,5;30;8;CMCMG00024;1;
Camisa ;com manga;SLASH CAVEIRA;P;Slash;;Slash Caveira;CAMISA CM P SLASH CAVEIRA;HCD;259;12,5;30;10;CMCMP00153;1;
Camisa ;com manga;SLASH CAVEIRA;M;Slash;;Slash Caveira;CAMISA CM M SLASH CAVEIRA;HCD;259;12,5;30;11;CMCMM00155;1;
Camisa ;com manga;SLASH CAVEIRA;G;Slash;;Slash Caveira;CAMISA CM G SLASH CAVEIRA;HCD;259;12,5;30;8;CMCMG00149;1;
